,place,start_date,end_date,name,price,description_short,rating,url,description
0,Valencia,2024-02-23,2024-03-03,Exclusivo apt. en centro histórico · AC · Wifi,€ 749,Entire apartment • 2 bedrooms • 1 living room • 1 bathroom • 1 kitchen • 80m²,,https://www.booking.com/hotel/es/exclusivo-apt-en-centro-historico-ac-wifi.en-gb.html?label=gen173nr-1FCAEoggI46AdICVgEaEaIAQGYAQm4AQfIAQ_YAQHoAQH4AQKIAgGoAgO4Ar2yua0GwAIB0gIkOTA3YTVlNDAtNjVmOS00MmQyLWFjZGMtZDdiMWYwOTg3MmE42AIF4AIB&aid=304142&ucfs=1&arphpl=1&checkin=2024-02-23&checkout=2024-03-03&dest_id=-406131&dest_type=city&group_adults=2&req_adults=2&no_rooms=1&group_children=0&req_children=0&hpos=1&hapos=1&sr_order=popularity&srpvid=689554a7c1b004a5&srepoch=1705924945&all_sr_blocks=1113241001_384253319_2_0_0&highlighted_blocks=1113241001_384253319_2_0_0&matching_block_id=1113241001_384253319_2_0_0&sr_pri_blocks=1113241001_384253319_2_0_0__74910&from=searchresults#hotelTmpl,"Situated in the centre of Valencia, 400 metres from Church of Saint Nicolás and 600 metres from Basilica de la Virgen de los Desamparados, Exclusivo apt. En centro histórico · AC · Wifi offers free WiFi and air conditioning. There is a private entrance at the apartment for the convenience of those who stay. The apartment has family rooms.

All units include a seating area, a flat-screen TV with cable channels, a fully equipped kitchen, a dining area, and a private bathroom fiitted with a hair dryer, while some units feature a terrace or a patio. A microwave, a toaster and fridge are also available, as well as a coffee machine and a kettle. At the apartment complex, each unit is fitted with bed linen and towels.

Dining options are available close to the apartment.

Popular points of interest near Exclusivo apt. En centro histórico · AC · Wifi include Jardines de Monforte, Turia Gardens and González Martí National Museum of Ceramics and Decorative Arts. The nearest airport is Valencia Airport, 8 km from the accommodation."
1,Valencia,2024-02-23,2024-03-03,Melia Valencia,"€ 2,766",Private suite • 1 bedroom • 1 living room • 2 bathrooms • 50m²,8.5,https://www.booking.com/hotel/es/melia-valencia.en-gb.html?label=gen173nr-1FCAEoggI46AdICVgEaEaIAQGYAQm4AQfIAQ_YAQHoAQH4AQKIAgGoAgO4Ar2yua0GwAIB0gIkOTA3YTVlNDAtNjVmOS00MmQyLWFjZGMtZDdiMWYwOTg3MmE42AIF4AIB&aid=304142&ucfs=1&arphpl=1&checkin=2024-02-23&checkout=2024-03-03&dest_id=-406131&dest_type=city&group_adults=2&req_adults=2&no_rooms=1&group_children=0&req_children=0&hpos=2&hapos=2&sr_order=popularity&srpvid=689554a7c1b004a5&srepoch=1705924945&all_sr_blocks=29049307_91989386_2_33_0&highlighted_blocks=29049307_91989386_2_33_0&matching_block_id=29049307_91989386_2_33_0&sr_pri_blocks=29049307_91989386_2_33_0__276600&nad_id=ed4133c0-490d-44ba-80e5-92c7abb700dc_0&nad_cpc=0.51&nad_track=eyJyYW5rIjoxLCJrb2RkaVRyYWNraW5nSW5mbyI6IjhwUmN6WEcrbFVwMHdONFg4UTFmSW9SNWFNQmdEMG1hUitzNzE2bW1KQitldm41NmluZmQzM0IrdXVEdVRTditxMDhmYWFBS24rem51RmJwcUxOR051QjVDTTdpc0Z6NndjRXpNUi9RV1RYWitPOVhMSU0zU0dMd1d6NXRKaWQ2RFdBcGhOK212SlhaZ2ducXJjalJrKzNLdG1zeHJFdGZSN3U0cXZSWjJwcUhLTlp2TWNWZGUvYlovVm5CYmxrUUhYSkREWkcxSnVSYy9NT3k5U1VxcFNMYUtmZDNJZ0VsNEppck1FTURqNWY4Um5objBBT2luaU1YRE5yWmRjTkhEdDdESmhUOHBUTklrTDl2UkF5c0RqOUwrV3g0ZGRwa1liOFUycUp6RGVvajVhTXBRL2JUVFNkaXM2SWJlOXQxTUcvV2ovNHhZOGVSWXRaOWo1d3FYM29SVXlGeTZwVUw0SGJzaDhXbzlPWndaa20wSFhsUXZhcGZXM3BUY1N4NUhJdjZKZHVlRW9KamMwcFBERmMrb3V5TS9BYmM4SGMyL2FVemlPOWNmYmZkaXZKVE1mOE9paGxPRWMyRC94SFc4WTBOZVFDTFc3ZmJJcmpmMWNxVE00bEpsU0tmazNvSjIvTTk2bmxhYU9QWWpUVDBtSVdwb2pFbkhGaGZKRndoZGYzNkFWK0NMNTY2dWpzN24yU1NzK3RSTDh3T2ZWNldyWnFQMlpkZUMzaldQT3dzckMxaEtlNG5HRmw1eFF2eTFNUi90aGpnMHdoeEtVRUJBZEFQTnlGVWh6SFRlVUZhTnQ0VllSQVNzaFZVTTliNkxpYjcxUjhoOXFKS0VVc042Z2ZzTm5Lb2hSNGdMRm9EbVY0L245WTMyQkU2Zk5JVzdKd1RSTTdMNDdUTTgyb3hwRVEvcmY3a2dCaDR5cE5MTGovYjJKNjRsWWhlbTdBS3gxODFyRlF2ZDk1ZE44ejBQNEJlM1ZYUnFxZFhMS3k3cDB2Zjd3QkR0MGIyTXFINFBBUWZnQ01QdTRUd1RHSGljSk5sMTl6ZERwdHhpNlZQdnA3Ym5CSm5aUFdLUWUyQ3o0bXF2Skw0aDNaQmo0VTFHeWlXZnIzU2pQQ2Znb2JOdHRzckJRbWRPUGNkMUZrMlA1NWRUbEs0WDhkSkc4V3JsenU0M0o5a0NDcGFZVk1RemdaNnhzQnB1STkxWEg1c1ZwazFkaGw5VlZSVmcvT3ZobFJzSk9uZXV3T0RyYXFNSE9qdGtCdlVtMGtXblo1THBoa2Nudm53dVVPdGNUblg3aFNNaWc4Z1gvMXI0NFVkRS9HYitwT3U3QnY1T0hkNkZtRU5uQTZoWE4yR0ZkNzZrRDVRL0FXTTdTb3h4c2xIRmVCbmQwVUhqNlZiUy9ZWE1iZDVpRnVDTFVqZmF1N295c0ZaNXlHSFJEcjRudnlRMzBSM3kvZG5OdWNXNGxTcnRxbU1WRVdVQXV5SzFBUGNnekJib3QyWmhQaHl0eldacjNzUWw3cHliVks2dkpTN25wY2YrYkV1YzlsK0xQbW81VUphS3phZkR3ZWJHdCt3MUdJY2RNZjNZQUpJYUVXWVV1TVUvRWhIVEEwT3kveHFDU3RuRVUzaEJPQTBUKzg5M2hGblE1VXh5M3JoOVhVdC9iaXNMQTMrQVVpWXBvS25pQ1hrcWVhVmFoN0lmQW5wYVhZVTRsSm1rOVNyTmpMZUpTd3dHWTFRaTkvZ1FyUjduQ2tHVWhhdXdhVHk4YnBoTjJMdUJ1TGMyRHIrdm05T3BuQXZLalBDclkyNkU2Y3VvN01WV1AwUFJWR3pvTitHaEphZjdTUE1GeWpoZDdRMCtUOU43VUIzVzNDWnZtRWV1WDhSZEJvTGJmVXI1dVQrM200anZDUE9LSlJkbGhsV1pWUWU2RFZ6RVpzVXQ1WDE2WEFUTk5UWTJpRm1PdVM0NTA2SmovMnlseUJyak0reG9iUWw5RlhHa2orTVNOSGM5ZnJRNzgxRkVhOWVuVVRrS3NVYzFJVUxyZnlkSERnUlBFUytXVEVBc0JpeHNOK0U2bFZYbjV1eXFDaUZPcnlsM1ZNQjdvSUZvTjRFZWtTMGxVOEMwV093T0NIY2R4MEtHTzJheE5wVEREWUUxVjJLVkcybDVBeHNrVnMyaVFaNVF0ZmtRMzNwclpHWTk1d0FVdjhTMmZ6R3oxTzlFM1ZzRjdjamFUbDhGVmNkYm5ZelptNUpsUGQ1bWFoYWJsbmk0ckpLdGNPei8vdEpKRkwxeFArNm5tSnpjdjcxaDNtd21ZQTVxeHRqbXczQ1R5d1RUUXNZYmdrNnl5V1JjTW0rVWFsendCQzhlY3VGM1RRMlFHWnJzZGUxUFhEMUpSR0NBSExGZnlOSk01TTdxUXZkZFVIQ0dBQ1NjeVIvd1N1KzRPbnBaOC9pYmxFV1IzdEY2RFBzVVl6VC95eTZoaThwaGp4M2YwSjkvclgvSnpkVU02c1psaWNkb1QxaXZPcEpOR0Z5dXRQdHdSeWhEdm5BOXJXc3pIME9FR3hqUkhyOWFybU50ZlpFc25pYVdsUkZhdFlrclVyK1dZbzIwc1ZiYTJMeHZpeXhaL3BzYWVTZElLcU1ic1pVMk5RUGlxSWkyYnNWY3ExT3BCS0srVXlkZjE5dTlxZ2F1Qy9SaHFYeUFhVnlPaDdvWDEzcEU4ZnMxZmtGSXRMOG51MG9sTm9YTTdjbndYUnBVbHE4R000ckhxRE9NUHIxZWNZeUxyS01FMXdua0h5ZUFqUXlndTNleHUvMWRwZE9uTW9LbHNGUHFMRjROSzRNMFRRTVVrVnBPUGtXendlMzBjcjNlNW1BY28wRE9YY2NNYlhiRmJnYWF3K21CLzVnTFFPQytORVpDeEk3bjFBVW5peE5qUnl5WHhYamZpRlBQL3hxVEZRVm9sMGF2Yk5kRjhEVkpkL1NqRkFxOXQ2OGlzRHYvN0sydlNKNGhhZ3NsWENmWGxjUW5zWHltRlZTOHhWWU96RlNpR3FRMGdQNXlJTnVlUHlpcVpvMVZDcFpCSDBQQnZUeENBbS9IekZES1k1ZVlEYmppNmRDcnBPVURBUGd3SDMvSWh2aGN0QzJ4UWlFM3MvR3lFQUR0UTFWTDJEYkFFWkI3RUdNYys4M0d5RnB6bit2WkZ5azhkckJSODg0aHpMd0NvS1lrZ3MrVXNaTFlWRVBibHEvVFd2NUVXTjVDaGxWZmFaK1YwSlluK1ZwQVJCdm5udjJVYWhYbGdyNUlxUFdPdkU9In0%3D&from_sustainable_property_sr=1&from=searchresults#hotelTmpl,"This modern Melia hotel is next to Valencia’s Palacio de Congresos Congress Centre and 5 km from the AVE Train Station. Beniferri Metro Station is just 400 metres away.

The spacious rooms feature contemporary design and offer spectacular views and a 49' flat-screen satellite TV. All are air conditioned and have free WiFi and modern bathrooms.

The hotel has a play area for children. Meeting rooms are available.  Some areas of the hotel are dedicated to The Level rooms and exclusive services, such as a private check-in and check-out area, exclusive buffet breakfast, daily snacks and drinks in a private area, as well as concierge service and organization of activities in the hotel. city.

Manises International Airport is just 15 minutes’ drive from the Melia Valencia.

The hotel's Socarrat restaurant specializes in Valencian paellas, as well as Mediterranean and international cuisine. The Oval Bar has a small snack and drink menu for every hour of the day."
2,Valencia,2024-02-23,2024-03-03,Hotel RH Sorolla Centro,"€ 1,585",,8.8,https://www.booking.com/hotel/es/sorolla.en-gb.html?label=gen173nr-1FCAEoggI46AdICVgEaEaIAQGYAQm4AQfIAQ_YAQHoAQH4AQKIAgGoAgO4Ar2yua0GwAIB0gIkOTA3YTVlNDAtNjVmOS00MmQyLWFjZGMtZDdiMWYwOTg3MmE42AIF4AIB&aid=304142&ucfs=1&arphpl=1&checkin=2024-02-23&checkout=2024-03-03&dest_id=-406131&dest_type=city&group_adults=2&req_adults=2&no_rooms=1&group_children=0&req_children=0&hpos=3&hapos=3&sr_order=popularity&srpvid=689554a7c1b004a5&srepoch=1705924945&all_sr_blocks=9089623_347401057_0_2_0&highlighted_blocks=9089623_347401057_0_2_0&matching_block_id=9089623_347401057_0_2_0&sr_pri_blocks=9089623_347401057_0_2_0__158460&from_sustainable_property_sr=1&from=searchresults#hotelTmpl,"Located on a pedestrian street, this hotel is 200 metres from Valencia Train Station, and just 50 metres from Plaza del Ayuntamiento Square. It offers modern rooms with air conditioning, satellite TV and free WiFi.

Bicycle and car rental can be arranged at the Sorolla’s 24-hour reception. Staff at reception can provide information about what to see and do in Valencia.

Buffet breakfast is offered everyday from 7:30 to 11:00. There are also many shops within a short walk of the hotel.

The central location of the Sorolla Centro allows guests to visit many of Valencia’s sights by foot. Xativa Metro Station is just 200 metres away."
3,Valencia,2024-02-23,2024-03-03,Flatsforyou Turia,€ 856,Entire apartment • 1 bedroom • 1 living room • 1 bathroom • 50m²,7.9,https://www.booking.com/hotel/es/apartamentos-carmen-design.en-gb.html?label=gen173nr-1FCAEoggI46AdICVgEaEaIAQGYAQm4AQfIAQ_YAQHoAQH4AQKIAgGoAgO4Ar2yua0GwAIB0gIkOTA3YTVlNDAtNjVmOS00MmQyLWFjZGMtZDdiMWYwOTg3MmE42AIF4AIB&aid=304142&ucfs=1&arphpl=1&checkin=2024-02-23&checkout=2024-03-03&dest_id=-406131&dest_type=city&group_adults=2&req_adults=2&no_rooms=1&group_children=0&req_children=0&hpos=4&hapos=4&sr_order=popularity&srpvid=689554a7c1b004a5&srepoch=1705924945&all_sr_blocks=31220702_370327940_0_0_0&highlighted_blocks=31220702_370327940_0_0_0&matching_block_id=31220702_370327940_0_0_0&sr_pri_blocks=31220702_370327940_0_0_0__85625&from=searchresults#hotelTmpl,"Located 800 metres from Basilica de la Virgen de los Desamparados in Valencia, Flatsforyou Turia provides accommodation with air conditioning and free WiFi.

The apartment provides guests with a balcony, a seating area, a flat-screen TV, a fully equipped kitchenette with a microwave and a fridge, and a private bathroom with shower.

Popular points of interest near Flatsforyou Turia include Jardines de Monforte, Turia Gardens and González Martí National Museum of Ceramics and Decorative Arts. The nearest airport is Valencia, 10 km from the accommodation, and the property offers a paid airport shuttle service."
4,Valencia,2024-02-23,2024-03-03,Valencia Luxury - Sea Port II,"€ 1,054",Entire apartment • 1 bedroom • 1 living room • 1 bathroom • 1 kitchen • 45m²,7.8,https://www.booking.com/hotel/es/sea-port-ii.en-gb.html?label=gen173nr-1FCAEoggI46AdICVgEaEaIAQGYAQm4AQfIAQ_YAQHoAQH4AQKIAgGoAgO4Ar2yua0GwAIB0gIkOTA3YTVlNDAtNjVmOS00MmQyLWFjZGMtZDdiMWYwOTg3MmE42AIF4AIB&aid=304142&ucfs=1&arphpl=1&checkin=2024-02-23&checkout=2024-03-03&dest_id=-406131&dest_type=city&group_adults=2&req_adults=2&no_rooms=1&group_children=0&req_children=0&hpos=5&hapos=5&sr_order=popularity&srpvid=689554a7c1b004a5&srepoch=1705924945&all_sr_blocks=755953201_381852214_0_0_0&highlighted_blocks=755953201_381852214_0_0_0&matching_block_id=755953201_381852214_0_0_0&sr_pri_blocks=755953201_381852214_0_0_0__105440&from=searchresults#hotelTmpl,"In the Camins al Grau district of Valencia, close to Puerto de Valencia, Valencia Luxury - Sea Port II has a rooftop pool and a washing machine. Featuring private check-in and check-out, this property also provides guests with a sun terrace. Offering free WiFi throughout the property, the non-smoking apartment features a fitness room.

The air-conditioned apartment consists of 1 bedroom, a living room, a fully equipped kitchen with a dishwasher and a coffee machine, and 1 bathroom with a shower and a hair dryer. A flat-screen TV is featured. The property offers city views.

A bicycle rental service is available at the apartment.

Popular points of interest near Valencia Luxury - Sea Port II include Turia Gardens, L'Oceanografic and Mestalla Stadium. The nearest airport is Valencia, 12 km from the accommodation, and the property offers a paid airport shuttle service."
5,Valencia,2024-02-23,2024-03-03,CAPSULE INN VALENCIA,€ 535,Shared dormitory room,8.5,https://www.booking.com/hotel/es/capsule-inn-valencia.en-gb.html?label=gen173nr-1FCAEoggI46AdICVgEaEaIAQGYAQm4AQfIAQ_YAQHoAQH4AQKIAgGoAgO4Ar2yua0GwAIB0gIkOTA3YTVlNDAtNjVmOS00MmQyLWFjZGMtZDdiMWYwOTg3MmE42AIF4AIB&aid=304142&ucfs=1&arphpl=1&checkin=2024-02-23&checkout=2024-03-03&dest_id=-406131&dest_type=city&group_adults=2&req_adults=2&no_rooms=1&group_children=0&req_children=0&hpos=6&hapos=6&sr_order=popularity&srpvid=689554a7c1b004a5&srepoch=1705924945&all_sr_blocks=1065293701_384543851_2_0_0&highlighted_blocks=1065293701_384543851_2_0_0&matching_block_id=1065293701_384543851_2_0_0&sr_pri_blocks=1065293701_384543851_2_0_0__53523&from=searchresults#hotelTmpl,"Well located in the Extramurs district of Valencia, CAPSULE INN VALENCIA is situated 1.7 km from Church of Saint Nicolás, 2.8 km from Turia Gardens and 1.5 km from González Martí National Museum of Ceramics and Decorative Arts. Among the facilities at this property are a shared kitchen and a shared lounge, along with free WiFi throughout the property. The property is non-smoking and is located less than 1 km from Norte Train Station.

Guest rooms are equipped with air conditioning, a dishwasher, a microwave, a coffee machine, a shower, free toiletries and a desk. The rooms include a shared bathroom, a hairdryer and bed linen.

Basilica de la Virgen de los Desamparados is 1.8 km from the capsule hotel, while Jardines de Monforte is 3.4 km away. The nearest airport is Valencia Airport, 8 km from CAPSULE INN VALENCIA."
6,Valencia,2024-02-23,2024-03-03,Lore Loft Valencia,€ 757,,,https://www.booking.com/hotel/es/lore-loft-valencia.en-gb.html?label=gen173nr-1FCAEoggI46AdICVgEaEaIAQGYAQm4AQfIAQ_YAQHoAQH4AQKIAgGoAgO4Ar2yua0GwAIB0gIkOTA3YTVlNDAtNjVmOS00MmQyLWFjZGMtZDdiMWYwOTg3MmE42AIF4AIB&aid=304142&ucfs=1&arphpl=1&checkin=2024-02-23&checkout=2024-03-03&dest_id=-406131&dest_type=city&group_adults=2&req_adults=2&no_rooms=1&group_children=0&req_children=0&hpos=7&hapos=7&sr_order=popularity&srpvid=689554a7c1b004a5&srepoch=1705924945&all_sr_blocks=1141097801_386962725_2_0_0&highlighted_blocks=1141097801_386962725_2_0_0&matching_block_id=1141097801_386962725_2_0_0&sr_pri_blocks=1141097801_386962725_2_0_0__75735&from=searchresults#hotelTmpl,"Situated in Valencia, 3 km from Malvarrosa Beach and 1.4 km from Puerto de Valencia, Lore Loft Valencia offers air conditioning. The property is around 3.1 km from Turia Gardens, 3.4 km from Jardines de Monforte and 1.9 km from L'Oceanografic. Free WiFi is available throughout the property and Playa de las Arenas is 2.4 km away.

Located on the ground floor, this apartment has 1 bedroom, a well-equipped kitchen with a microwave and a fridge, a living room, and a flat-screen TV. Towels and bed linen are offered in the apartment. For added privacy, the accommodation features a private entrance.

Norte Train Station is 3.9 km from the apartment, while González Martí National Museum of Ceramics and Decorative Arts is 4.4 km from the property. The nearest airport is Valencia Airport, 13 km from Lore Loft Valencia."
7,Valencia,2024-02-23,2024-03-03,FLORIT FLATS - The Serreria Rooms,€ 799,,8.2,https://www.booking.com/hotel/es/the-serreria-rooms.en-gb.html?label=gen173nr-1FCAEoggI46AdICVgEaEaIAQGYAQm4AQfIAQ_YAQHoAQH4AQKIAgGoAgO4Ar2yua0GwAIB0gIkOTA3YTVlNDAtNjVmOS00MmQyLWFjZGMtZDdiMWYwOTg3MmE42AIF4AIB&aid=304142&ucfs=1&arphpl=1&checkin=2024-02-23&checkout=2024-03-03&dest_id=-406131&dest_type=city&group_adults=2&req_adults=2&no_rooms=1&group_children=0&req_children=0&hpos=8&hapos=8&sr_order=popularity&srpvid=689554a7c1b004a5&srepoch=1705924945&all_sr_blocks=851382108_352429295_4_0_0&highlighted_blocks=851382108_352429295_4_0_0&matching_block_id=851382108_352429295_4_0_0&sr_pri_blocks=851382108_352429295_4_0_0__79918&from=searchresults#hotelTmpl,"Situated in Valencia, 1.2 km from Playa de las Arenas, FLORIT FLATS - The Serreria Rooms features air-conditioned rooms with free WiFi and express check-in and check-out. There is a private entrance at the guest house for the convenience of those who stay. The guest house has family rooms and facilities for disabled guests.

Each unit has a fully equipped kitchen with a dishwasher, a seating area, a flat-screen TV, a washing machine, and a private bathroom with shower and a hair dryer. An oven, a microwave and toaster are also available, as well as a coffee machine and a kettle. At the guest house, each unit is fitted with bed linen and towels.

For guests with children, the guest house offers a baby safety gate.

Malvarrosa Beach is 1.5 km from FLORIT FLATS - The Serreria Rooms, while Patacona Beach is 2.3 km from the property. The nearest airport is Valencia, 12 km from the accommodation, and the property offers a paid airport shuttle service."
8,Valencia,2024-02-23,2024-03-03,Albergue Juvenil Colegio Mayor Galileo Galilei,€ 710,,7.4,https://www.booking.com/hotel/es/colegio-mayor-galileo-galilei.en-gb.html?label=gen173nr-1FCAEoggI46AdICVgEaEaIAQGYAQm4AQfIAQ_YAQHoAQH4AQKIAgGoAgO4Ar2yua0GwAIB0gIkOTA3YTVlNDAtNjVmOS00MmQyLWFjZGMtZDdiMWYwOTg3MmE42AIF4AIB&aid=304142&ucfs=1&arphpl=1&checkin=2024-02-23&checkout=2024-03-03&dest_id=-406131&dest_type=city&group_adults=2&req_adults=2&no_rooms=1&group_children=0&req_children=0&hpos=9&hapos=9&sr_order=popularity&srpvid=689554a7c1b004a5&srepoch=1705924945&all_sr_blocks=25310303_386221303_0_42_0&highlighted_blocks=25310303_386221303_0_42_0&matching_block_id=25310303_386221303_0_42_0&sr_pri_blocks=25310303_386221303_0_42_0__70970&from=searchresults#hotelTmpl,"The Galileo Galilei hall of residence, next to the Universidad Politécnica de Valencia and Tarongers Metro Station, offers well-priced, spacious accommodation with a fitness centre. All rooms have free Wi-Fi and a private bathroom.

The rooms in Colegio Mayor Galileo Galilei are decorated in a unique style. All rooms have a seating area as well as a work area. Children under 12 stay for free when using existing bedding.

The Colegio Mayor Galileo Galilei has a games room and 24-hour reception. It also has a shared kitchen for guests where they can cook.

The residence is about 1 km from the beach. Its proximity to the Metro means you can quickly reach Valencia city centre."
9,Valencia,2024-02-23,2024-03-03,Best Valencia Beach Flat Historic Area next to the Beach,€ 899,,8.1,https://www.booking.com/hotel/es/best-valencia-beach-flat-historic-area-next-to-the-beach.en-gb.html?label=gen173nr-1FCAEoggI46AdICVgEaEaIAQGYAQm4AQfIAQ_YAQHoAQH4AQKIAgGoAgO4Ar2yua0GwAIB0gIkOTA3YTVlNDAtNjVmOS00MmQyLWFjZGMtZDdiMWYwOTg3MmE42AIF4AIB&aid=304142&ucfs=1&arphpl=1&checkin=2024-02-23&checkout=2024-03-03&dest_id=-406131&dest_type=city&group_adults=2&req_adults=2&no_rooms=1&group_children=0&req_children=0&hpos=10&hapos=10&sr_order=popularity&srpvid=689554a7c1b004a5&srepoch=1705924945&all_sr_blocks=845470402_351514851_2_0_0&highlighted_blocks=845470402_351514851_2_0_0&matching_block_id=845470402_351514851_2_0_0&sr_pri_blocks=845470402_351514851_2_0_0__89864&from_sustainable_property_sr=1&from=searchresults#hotelTmpl,"Set in Valencia, 800 metres from Playa de las Arenas, Best Valencia Beach Flat Historic Area next to the Beach offers air-conditioned rooms with free WiFi and express check-in and check-out. This sustainable apartment is located less than 1 km from Malvarrosa Beach and 1.9 km from Patacona Beach. When staying at the apartment, guests can use private entrance.

All units include a seating area, a flat-screen TV with streaming services, a fully equipped kitchen, a dining area, and a private bathroom fiitted with a hair dryer, while some units feature a terrace or a patio. A microwave, a toaster and fridge are also offered, as well as a coffee machine and a kettle. At the apartment complex, the units include bed linen and towels.

A car rental service is available at Best Valencia Beach Flat Historic Area next to the Beach.

Puerto de Valencia is 1.5 km from the accommodation, while Turia Gardens is 4.2 km from the property. The nearest airport is Valencia Airport, 13 km from Best Valencia Beach Flat Historic Area next to the Beach."
10,Valencia,2024-02-23,2024-03-03,Bet Apartments - Reig,"€ 1,219",Entire studio • 1 bathroom • 1 kitchen • 35m²,8.5,https://www.booking.com/hotel/es/city-suites-universidades.en-gb.html?label=gen173nr-1FCAEoggI46AdICVgEaEaIAQGYAQm4AQfIAQ_YAQHoAQH4AQKIAgGoAgO4Ar2yua0GwAIB0gIkOTA3YTVlNDAtNjVmOS00MmQyLWFjZGMtZDdiMWYwOTg3MmE42AIF4AIB&aid=304142&ucfs=1&arphpl=1&checkin=2024-02-23&checkout=2024-03-03&dest_id=-406131&dest_type=city&group_adults=2&req_adults=2&no_rooms=1&group_children=0&req_children=0&hpos=11&hapos=11&sr_order=popularity&srpvid=689554a7c1b004a5&srepoch=1705924945&all_sr_blocks=607682106_385554219_3_0_0&highlighted_blocks=607682106_385554219_3_0_0&matching_block_id=607682106_385554219_3_0_0&sr_pri_blocks=607682106_385554219_3_0_0__121892&from_sustainable_property_sr=1&from=searchresults#hotelTmpl,"Located in Valencia, less than 1 km from Jardines de Monforte, Bet Apartments - Reig provides air-conditioned rooms with free WiFi and express check-in and check-out. This sustainable aparthotel is located 1.3 km from Turia Gardens and 2.9 km from González Martí National Museum of Ceramics and Decorative Arts. The aparthotel features family rooms.

Each unit is equipped with a fully equipped kitchen with a microwave, a seating area, a TV and a private bathroom with shower and a hair dryer. A toaster, a fridge and kitchenware are also provided, as well as a coffee machine and a kettle. The units include bed linen.

Basilica de la Virgen de los Desamparados is 1.9 km from the aparthotel, while Norte Train Station is 3.4 km away. The nearest airport is Valencia Airport, 11 km from Bet Apartments - Reig."
11,Valencia,2024-02-23,2024-03-03,Travel Habitat La Marina Real,€ 910,Entire studio • 1 bathroom • 1 kitchen • 45m²,8.4,https://www.booking.com/hotel/es/travel-habitat-la-marian-real.en-gb.html?label=gen173nr-1FCAEoggI46AdICVgEaEaIAQGYAQm4AQfIAQ_YAQHoAQH4AQKIAgGoAgO4Ar2yua0GwAIB0gIkOTA3YTVlNDAtNjVmOS00MmQyLWFjZGMtZDdiMWYwOTg3MmE42AIF4AIB&aid=304142&ucfs=1&arphpl=1&checkin=2024-02-23&checkout=2024-03-03&dest_id=-406131&dest_type=city&group_adults=2&req_adults=2&no_rooms=1&group_children=0&req_children=0&hpos=12&hapos=12&sr_order=popularity&srpvid=689554a7c1b004a5&srepoch=1705924945&all_sr_blocks=838020505_384317552_2_0_0&highlighted_blocks=838020505_384317552_2_0_0&matching_block_id=838020505_384317552_2_0_0&sr_pri_blocks=838020505_384317552_2_0_0__90960&from=searchresults#hotelTmpl,"Ideally situated in the Poblats Maritims district of Valencia, Travel Habitat La Marina Real is situated 2.5 km from Malvarrosa Beach, 500 metres from Puerto de Valencia and 3.3 km from L'Oceanografic. There is a private entrance at the apartment for the convenience of those who stay. Free WiFi is available throughout the property and Playa de las Arenas is 1.4 km away.

All units in the apartment complex are fitted with air conditioning, a seating area, a flat-screen TV with streaming services, a kitchen, a dining area, a safety deposit box and a private bathroom with a shower, a hair dryer and free toiletries. A microwave, a toaster and fridge are also available, as well as a coffee machine and a kettle. At the apartment complex, each unit is fitted with bed linen and towels.

Sightseeing tours are available within a reachable distance of the property. A bicycle rental service is available at the apartment.

Turia Gardens is 3.8 km from Travel Habitat La Marina Real, while Jardines de Monforte is 4 km from the property. The nearest airport is Valencia, 13 km from the accommodation, and the property offers a paid airport shuttle service."
12,Valencia,2024-02-23,2024-03-03,Eurostars Rey Don Jaime,"€ 1,460",,7.9,https://www.booking.com/hotel/es/eurostars-rey-don-jaime.en-gb.html?label=gen173nr-1FCAEoggI46AdICVgEaEaIAQGYAQm4AQfIAQ_YAQHoAQH4AQKIAgGoAgO4Ar2yua0GwAIB0gIkOTA3YTVlNDAtNjVmOS00MmQyLWFjZGMtZDdiMWYwOTg3MmE42AIF4AIB&aid=304142&ucfs=1&arphpl=1&checkin=2024-02-23&checkout=2024-03-03&dest_id=-406131&dest_type=city&group_adults=2&req_adults=2&no_rooms=1&group_children=0&req_children=0&hpos=13&hapos=13&sr_order=popularity&srpvid=689554a7c1b004a5&srepoch=1705924945&all_sr_blocks=9152002_384631035_2_34_0&highlighted_blocks=9152002_384631035_2_34_0&matching_block_id=9152002_384631035_2_34_0&sr_pri_blocks=9152002_384631035_2_34_0__145994&from_sustainable_property_sr=1&from=searchresults#hotelTmpl,"Eurostars Rey Don Jaime is located opposite the pretty River Túria Gardens and Valencia's Palau de la Música. It features a roof top terrace with a pool and free WiFi throughout.

The impressive 14-floor tower of the Rey Don Jaime offers rooms with air conditioning, heating and satellite TV for an extra cost. All rooms have a large wardrobe.

The City of Arts and Sciences can be reached in around 15 minutes, on foot from the hotel. Valencia’s seafront and the closest beach are 3.6 km away. The local bus 19 stops at the corner of Eurostars Rey Don Jaime and connects with the city centre and the beach."
