,place,start_date,end_date,name,price,description_short,rating,url,description
273,Valencia,2024-02-23,2024-03-03,ApartUP Patacona Sunrise Duplex,"€ 1,901",Entire apartment • 2 bedrooms • 1 living room • 1 bathroom • 1 kitchen • 75m²,9.1,https://www.booking.com/hotel/es/apartup-patacona-sunrise-duplex-alboraya.en-gb.html?label=gen173nr-1FCAEoggI46AdICVgEaEaIAQGYAQm4AQfIAQ_YAQHoAQH4AQKIAgGoAgO4Ar2yua0GwAIB0gIkOTA3YTVlNDAtNjVmOS00MmQyLWFjZGMtZDdiMWYwOTg3MmE42AIF4AIB&aid=304142&ucfs=1&arphpl=1&checkin=2024-02-23&checkout=2024-03-03&dest_id=-406131&dest_type=city&group_adults=2&req_adults=2&no_rooms=1&group_children=0&req_children=0&hpos=23&hapos=273&sr_order=popularity&srpvid=689554a7c1b004a5&srepoch=1705925000&all_sr_blocks=978910102_372892866_4_0_0&highlighted_blocks=978910102_372892866_4_0_0&matching_block_id=978910102_372892866_4_0_0&sr_pri_blocks=978910102_372892866_4_0_0__190139&from=searchresults#hotelTmpl,"Set in Valencia, 400 metres from Patacona Beach and 800 metres from Malvarrosa Beach, ApartUP Patacona Sunrise Duplex offers a seasonal outdoor swimming pool and air conditioning. This beachfront property offers access to a balcony, free private parking and free WiFi. The accommodation offers a lift, full-day security and organising tours for guests.

The spacious apartment with a terrace and sea views features 2 bedrooms, a living room, a flat-screen TV, an equipped kitchen with a dishwasher and an oven, and 1 bathroom with a bath. Towels and bed linen are featured in the apartment. The property has an outdoor dining area.

For guests with children, the apartment features kids pool and a children's playground. Guests can relax in the garden at the property.

Playa de las Arenas is 1.8 km from ApartUP Patacona Sunrise Duplex, while Puerto de Valencia is 3.9 km away. The nearest airport is Valencia Airport, 18 km from the accommodation."
274,Valencia,2024-02-23,2024-03-03,Studio beach,€ 605,,8.4,https://www.booking.com/hotel/es/studio-near-the-beach-valencia.en-gb.html?label=gen173nr-1FCAEoggI46AdICVgEaEaIAQGYAQm4AQfIAQ_YAQHoAQH4AQKIAgGoAgO4Ar2yua0GwAIB0gIkOTA3YTVlNDAtNjVmOS00MmQyLWFjZGMtZDdiMWYwOTg3MmE42AIF4AIB&aid=304142&ucfs=1&arphpl=1&checkin=2024-02-23&checkout=2024-03-03&dest_id=-406131&dest_type=city&group_adults=2&req_adults=2&no_rooms=1&group_children=0&req_children=0&hpos=24&hapos=274&sr_order=popularity&srpvid=689554a7c1b004a5&srepoch=1705925000&all_sr_blocks=944126804_367272879_2_0_0&highlighted_blocks=944126804_367272879_2_0_0&matching_block_id=944126804_367272879_2_0_0&sr_pri_blocks=944126804_367272879_2_0_0__60512&from=searchresults#hotelTmpl,"Studio beach is situated in the Poblats Maritims district of Valencia, 700 metres from Malvarrosa Beach, 1.4 km from Playa de las Arenas and 3.5 km from Puerto de Valencia. The property has garden and inner courtyard views, and is 500 metres from Patacona Beach. The homestay has private entrance.

The air-conditioned units have a fully equipped kitchen with dining area, a microwave, kettle, and a fridge. Units include a coffee machine, a private bathroom and free WiFi, while selected rooms also boast a terrace and some have city views. At the homestay, every unit comes with bed linen and towels.

Guests at the homestay will be able to enjoy activities in and around Valencia, like hiking.

Jardines de Monforte is 5.1 km from Studio beach, while Turia Gardens is 5.4 km from the property. The nearest airport is Valencia Airport, 14 km from the accommodation."
275,Valencia,2024-02-23,2024-03-03,NWT Central Station Valencia,€ 597,,5.9,https://www.booking.com/hotel/es/central-station-valencia-hostel.en-gb.html?label=gen173nr-1FCAEoggI46AdICVgEaEaIAQGYAQm4AQfIAQ_YAQHoAQH4AQKIAgGoAgO4Ar2yua0GwAIB0gIkOTA3YTVlNDAtNjVmOS00MmQyLWFjZGMtZDdiMWYwOTg3MmE42AIF4AIB&aid=304142&ucfs=1&arphpl=1&checkin=2024-02-23&checkout=2024-03-03&dest_id=-406131&dest_type=city&group_adults=2&req_adults=2&no_rooms=1&group_children=0&req_children=0&hpos=25&hapos=275&sr_order=popularity&srpvid=689554a7c1b004a5&srepoch=1705925000&all_sr_blocks=164701703_89403115_0_0_0&highlighted_blocks=164701703_89403115_0_0_0&matching_block_id=164701703_89403115_0_0_0&sr_pri_blocks=164701703_89403115_0_0_0__59701&from=searchresults#hotelTmpl,"NWT Central Station Valencia is situated in the Extramurs district in Valencia, 1.2 km from Barrio del Carmen.  This property features free WiFi .

Rooms at this hostel include air conditioning and heating. Some rooms have private bathrooms and other have access to shared bathroom facilities.

There is a 24-hour front desk at the property.

City of Arts & Sciences is 2.4 km from NWT Central Station Valencia, while Oceanografic is 3 km from the property. The nearest airport is Valencia Airport, 9 km from NWT Central Station Valencia ."
276,Valencia,2024-02-23,2024-03-03,FLORIT FLATS - The Ruzafa Loft,"€ 1,280",Entire apartment • 2 bedrooms • 1 bathroom • 40m²,7.6,https://www.booking.com/hotel/es/the-ruzafa-loft-valencia12345.en-gb.html?label=gen173nr-1FCAEoggI46AdICVgEaEaIAQGYAQm4AQfIAQ_YAQHoAQH4AQKIAgGoAgO4Ar2yua0GwAIB0gIkOTA3YTVlNDAtNjVmOS00MmQyLWFjZGMtZDdiMWYwOTg3MmE42AIF4AIB&aid=304142&ucfs=1&arphpl=1&checkin=2024-02-23&checkout=2024-03-03&dest_id=-406131&dest_type=city&group_adults=2&req_adults=2&no_rooms=1&group_children=0&req_children=0&hpos=1&hapos=276&sr_order=popularity&srpvid=689554a7c1b004a5&srepoch=1705925005&all_sr_blocks=829925601_347631905_4_0_0&highlighted_blocks=829925601_347631905_4_0_0&matching_block_id=829925601_347631905_4_0_0&sr_pri_blocks=829925601_347631905_4_0_0__127986&from=searchresults#hotelTmpl,"FLORIT FLATS - The Ruzafa Loft is situated in the Eixample district of Valencia, 1.9 km from Turia Gardens, 1.4 km from González Martí National Museum of Ceramics and Decorative Arts and 1.8 km from Basilica de la Virgen de los Desamparados. The property is around 3.1 km from Jardines de Monforte, 1.8 km from Church of Saint Nicolás and 4.4 km from L'Oceanografic. Free WiFi is available throughout the property and Norte Train Station is 700 metres away.

Offering 2 bedrooms and 1 bathroom, this apartment features a flat-screen TV. The accommodation is non-smoking.

For those times when you'd rather not dine out, you can choose to cook in your kitchenette. Dining options are available close to the apartment.

Puerto de Valencia is 4.8 km from FLORIT FLATS - The Ruzafa Loft, while Bioparc Valencia is 5.7 km from the property. The nearest airport is Valencia Airport, 9 km from the accommodation."
277,Valencia,2024-02-23,2024-03-03,València Centre Túria,"€ 1,919",Entire apartment • 1 bedroom • 1 living room • 1 bathroom • 1 kitchen • 55m²,8.1,https://www.booking.com/hotel/es/valencia-centre-turia.en-gb.html?label=gen173nr-1FCAEoggI46AdICVgEaEaIAQGYAQm4AQfIAQ_YAQHoAQH4AQKIAgGoAgO4Ar2yua0GwAIB0gIkOTA3YTVlNDAtNjVmOS00MmQyLWFjZGMtZDdiMWYwOTg3MmE42AIF4AIB&aid=304142&ucfs=1&arphpl=1&checkin=2024-02-23&checkout=2024-03-03&dest_id=-406131&dest_type=city&group_adults=2&req_adults=2&no_rooms=1&group_children=0&req_children=0&hpos=2&hapos=277&sr_order=popularity&srpvid=689554a7c1b004a5&srepoch=1705925005&all_sr_blocks=218525501_97566111_2_0_0&highlighted_blocks=218525501_97566111_2_0_0&matching_block_id=218525501_97566111_2_0_0&sr_pri_blocks=218525501_97566111_2_0_0__191900&from=searchresults#hotelTmpl,"Set in Valencia, 800 metres from Church of Saint Nicolás and 1.1 km from Basilica de la Virgen de los Desamparados, València Centre Túria offers air conditioning. Among the facilities at this property are a lift and a tour desk, along with free WiFi throughout the property. Staff on-site can arrange a shuttle service.

The apartment with a balcony and city views has 1 bedroom, a living room, a flat-screen TV, an equipped kitchen with an oven and a microwave, and 1 bathroom with a shower. Towels and bed linen are offered in the apartment. This apartment is allergy-free and non-smoking.

Popular points of interest near the apartment include González Martí National Museum of Ceramics and Decorative Arts, Norte Train Station and Valencia Botanical Gardens. The nearest airport is Valencia, 8 km from València Centre Túria, and the property offers a paid airport shuttle service."
278,Valencia,2024-02-23,2024-03-03,El Cid,€ 881,Entire apartment • 3 bedrooms • 1 living room • 1 bathroom • 1 kitchen • 75m²,8.5,https://www.booking.com/hotel/es/el-cid-valencia.en-gb.html?label=gen173nr-1FCAEoggI46AdICVgEaEaIAQGYAQm4AQfIAQ_YAQHoAQH4AQKIAgGoAgO4Ar2yua0GwAIB0gIkOTA3YTVlNDAtNjVmOS00MmQyLWFjZGMtZDdiMWYwOTg3MmE42AIF4AIB&aid=304142&ucfs=1&arphpl=1&checkin=2024-02-23&checkout=2024-03-03&dest_id=-406131&dest_type=city&group_adults=2&req_adults=2&no_rooms=1&group_children=0&req_children=0&hpos=3&hapos=278&sr_order=popularity&srpvid=689554a7c1b004a5&srepoch=1705925005&all_sr_blocks=274080101_329769523_2_0_0&highlighted_blocks=274080101_329769523_2_0_0&matching_block_id=274080101_329769523_2_0_0&sr_pri_blocks=274080101_329769523_2_0_0__88050&from=searchresults#hotelTmpl,"Set in Valencia, 1.5 km from Bioparc Valencia and 3.3 km from Church of Saint Nicolás, El Cid offers air-conditioned accommodation with a balcony and free WiFi. With quiet street views, this accommodation provides a patio. González Martí National Museum of Ceramics and Decorative Arts is 4.7 km away and Basilica de la Virgen de los Desamparados is 4.8 km from the apartment.

The spacious apartment with a terrace and city views features 3 bedrooms, a living room, a flat-screen TV, an equipped kitchen with an oven and a microwave, and 1 bathroom with a shower. Towels and bed linen are featured in the apartment. The property has an outdoor dining area.

Guests can also relax in the garden.

Norte Train Station is 3.5 km from the apartment, while Turia Gardens is 4.6 km away. The nearest airport is Valencia Airport, 6 km from El Cid."
279,Valencia,2024-02-23,2024-03-03,"Palacio Santa Clara, Autograph Collection","€ 3,718",,9.1,https://www.booking.com/hotel/es/palacio-santa-clara-autograph-collection.en-gb.html?label=gen173nr-1FCAEoggI46AdICVgEaEaIAQGYAQm4AQfIAQ_YAQHoAQH4AQKIAgGoAgO4Ar2yua0GwAIB0gIkOTA3YTVlNDAtNjVmOS00MmQyLWFjZGMtZDdiMWYwOTg3MmE42AIF4AIB&aid=304142&ucfs=1&arphpl=1&checkin=2024-02-23&checkout=2024-03-03&dest_id=-406131&dest_type=city&group_adults=2&req_adults=2&no_rooms=1&group_children=0&req_children=0&hpos=4&hapos=279&sr_order=popularity&srpvid=689554a7c1b004a5&srepoch=1705925005&all_sr_blocks=621284102_242295886_0_2_0&highlighted_blocks=621284102_242295886_0_2_0&matching_block_id=621284102_242295886_0_2_0&sr_pri_blocks=621284102_242295886_0_2_0__371800&from_sustainable_property_sr=1&from=searchresults#hotelTmpl,"Palacio Santa Clara, Autograph Collection features a shared lounge, terrace, a restaurant and bar in Valencia. With free WiFi, this 4-star hotel offers room service and a concierge service. The property is 700 metres from the city centre and 400 metres from Norte Train Station.

The units at the hotel come with a seating area, a flat-screen TV with satellite channels, a safety deposit box and a private bathroom with a shower, free toiletries and a hairdryer. Palacio Santa Clara, Autograph Collection offers certain units with city views, and every room has a coffee machine. At the accommodation every room is fitted with bed linen and towels.

Speaking Arabic, English, Spanish and French at the reception, staff will be happy to provide guests with practical information on the area.

Popular points of interest near Palacio Santa Clara, Autograph Collection include Turia Gardens, González Martí National Museum of Ceramics and Decorative Arts and Basilica de la Virgen de los Desamparados. The nearest airport is Valencia Airport, 8 km from the hotel."
280,Valencia,2024-02-23,2024-03-03,Maison Sereine,€ 628,Entire apartment • 2 bedrooms • 1 living room • 1 bathroom • 1 kitchen • 70m²,,https://www.booking.com/hotel/es/maison-sereine.en-gb.html?label=gen173nr-1FCAEoggI46AdICVgEaEaIAQGYAQm4AQfIAQ_YAQHoAQH4AQKIAgGoAgO4Ar2yua0GwAIB0gIkOTA3YTVlNDAtNjVmOS00MmQyLWFjZGMtZDdiMWYwOTg3MmE42AIF4AIB&aid=304142&ucfs=1&arphpl=1&checkin=2024-02-23&checkout=2024-03-03&dest_id=-406131&dest_type=city&group_adults=2&req_adults=2&no_rooms=1&group_children=0&req_children=0&hpos=5&hapos=280&sr_order=popularity&srpvid=689554a7c1b004a5&srepoch=1705925005&all_sr_blocks=1119687401_385751526_2_0_0&highlighted_blocks=1119687401_385751526_2_0_0&matching_block_id=1119687401_385751526_2_0_0&sr_pri_blocks=1119687401_385751526_2_0_0__62834&from=searchresults#hotelTmpl,"Located in Valencia, 3.1 km from Church of Saint Nicolás and 4 km from Basilica de la Virgen de los Desamparados, Maison Sereine provides air-conditioned accommodation with a patio and free WiFi. This recently renovated apartment is located 4 km from Jardines de Monforte and 4.1 km from Turia Gardens. The property is non-smoking and is set 4.3 km from González Martí National Museum of Ceramics and Decorative Arts.

The spacious apartment comes with 2 bedrooms, 1 bathroom, bed linen, towels, a flat-screen TV with cable channels, a dining area, a fully equipped kitchen, and a terrace with inner courtyard views. For added privacy, the accommodation features a private entrance.

Sightseeing tours are available near the property.

Bioparc Valencia is 4.5 km from the apartment, while Norte Train Station is 5.4 km away. The nearest airport is Valencia Airport, 11 km from Maison Sereine."
281,Valencia,2024-02-23,2024-03-03,FLORIT FLATS - Traditional House in El Cabanyal,"€ 1,161",Entire apartment • 2 bedrooms • 1 living room • 1 bathroom • 94m²,7.9,https://www.booking.com/hotel/es/traditional-house-in-el-cabanyal.en-gb.html?label=gen173nr-1FCAEoggI46AdICVgEaEaIAQGYAQm4AQfIAQ_YAQHoAQH4AQKIAgGoAgO4Ar2yua0GwAIB0gIkOTA3YTVlNDAtNjVmOS00MmQyLWFjZGMtZDdiMWYwOTg3MmE42AIF4AIB&aid=304142&ucfs=1&arphpl=1&checkin=2024-02-23&checkout=2024-03-03&dest_id=-406131&dest_type=city&group_adults=2&req_adults=2&no_rooms=1&group_children=0&req_children=0&hpos=6&hapos=281&sr_order=popularity&srpvid=689554a7c1b004a5&srepoch=1705925005&all_sr_blocks=902871001_361084286_4_0_0&highlighted_blocks=902871001_361084286_4_0_0&matching_block_id=902871001_361084286_4_0_0&sr_pri_blocks=902871001_361084286_4_0_0__116079&from=searchresults#hotelTmpl,"FLORIT FLATS - Traditional House in El Cabanyal has a terrace and is set in Valencia, within just 1.5 km of Malvarrosa Beach and less than 1 km of Puerto de Valencia. It is situated 2.4 km from Patacona Beach and offers private check-in and check-out. Free WiFi is available throughout the property and Playa de las Arenas is less than 1 km away.

The spacious apartment is fitted with 2 bedrooms, a fully equipped kitchenette with a dishwasher and an oven, and 1 bathroom with a bath, a hair dryer and a washing machine. Towels and bed linen are offered in the apartment. For added privacy, the accommodation features a private entrance.

L'Oceanografic is 3.9 km from the apartment, while Turia Gardens is 4.9 km from the property. The nearest airport is Valencia, 14 km from FLORIT FLATS - Traditional House in El Cabanyal, and the property offers a paid airport shuttle service."
282,Valencia,2024-02-23,2024-03-03,NON STRESS Arena Primera línea de Playa,"€ 1,494",Entire apartment • 1 bedroom • 1 bathroom • 1 kitchen • 52m²,9.5,https://www.booking.com/hotel/es/non-stress-arena-primera-linea-de-playa.en-gb.html?label=gen173nr-1FCAEoggI46AdICVgEaEaIAQGYAQm4AQfIAQ_YAQHoAQH4AQKIAgGoAgO4Ar2yua0GwAIB0gIkOTA3YTVlNDAtNjVmOS00MmQyLWFjZGMtZDdiMWYwOTg3MmE42AIF4AIB&aid=304142&ucfs=1&arphpl=1&checkin=2024-02-23&checkout=2024-03-03&dest_id=-406131&dest_type=city&group_adults=2&req_adults=2&no_rooms=1&group_children=0&req_children=0&hpos=7&hapos=282&sr_order=popularity&srpvid=689554a7c1b004a5&srepoch=1705925005&all_sr_blocks=757876401_332782427_2_0_0&highlighted_blocks=757876401_332782427_2_0_0&matching_block_id=757876401_332782427_2_0_0&sr_pri_blocks=757876401_332782427_2_0_0__149370&from_sustainable_property_sr=1&from=searchresults#hotelTmpl,"Surrounded by views of the garden, NON STRESS Arena Primera línea de Playa is a sustainable apartment in Valencia, offering guests an environmentally friendly accommodation close to Patacona Beach. This beachfront property offers access to a patio, free private parking and free WiFi. The property offers bike hire and features a garden and sun terrace.

The apartment is equipped with 1 bedroom, 1 bathroom, bed linen, towels, a flat-screen TV with streaming services, a fully equipped kitchen, and a balcony with sea views. The accommodation is non-smoking.

A minimarket is available at the apartment.

Guests at the apartment will be able to enjoy activities in and around Valencia, like hiking.

Malvarrosa Beach is 400 metres from NON STRESS Arena Primera línea de Playa, while Playa de las Arenas is 1.5 km away. The nearest airport is Valencia Airport, 18 km from the accommodation."
283,Valencia,2024-02-23,2024-03-03,SingularStays Santa Clara,"€ 2,819",Entire apartment • 3 bedrooms • 1 living room • 1 bathroom • 1 kitchen • 150m²,7.6,https://www.booking.com/hotel/es/singularstays-santa-clara.en-gb.html?label=gen173nr-1FCAEoggI46AdICVgEaEaIAQGYAQm4AQfIAQ_YAQHoAQH4AQKIAgGoAgO4Ar2yua0GwAIB0gIkOTA3YTVlNDAtNjVmOS00MmQyLWFjZGMtZDdiMWYwOTg3MmE42AIF4AIB&aid=304142&ucfs=1&arphpl=1&checkin=2024-02-23&checkout=2024-03-03&dest_id=-406131&dest_type=city&group_adults=2&req_adults=2&no_rooms=1&group_children=0&req_children=0&hpos=8&hapos=283&sr_order=popularity&srpvid=689554a7c1b004a5&srepoch=1705925005&all_sr_blocks=343206601_116990987_3_0_0&highlighted_blocks=343206601_116990987_3_0_0&matching_block_id=343206601_116990987_3_0_0&sr_pri_blocks=343206601_116990987_3_0_0__281905&from=searchresults#hotelTmpl,"SingularStays Santa Clara is located in the Ciutat Vella district of Valencia, 600 metres from González Martí National Museum of Ceramics and Decorative Arts, 1 km from Basilica de la Virgen de los Desamparados and 1.7 km from Jardines de Monforte. It is set 1.4 km from Turia Gardens and offers free WiFi plus a lift. The property is 700 metres from the city centre and 300 metres from Norte Train Station.

The spacious apartment is composed of 3 bedrooms, a living room, a fully equipped kitchen, and 1 bathroom. Towels and bed linen are featured in the apartment. The accommodation is non-smoking.

Dining options are available close to the apartment.

Church of Saint Nicolás is 1.1 km from SingularStays Santa Clara, while L'Oceanografic is 4.4 km away. The nearest airport is Valencia, 8 km from the accommodation, and the property offers a paid airport shuttle service."
284,Valencia,2024-02-23,2024-03-03,Valencia Town Center New Apartments,€ 966,Entire apartment • 1 bedroom • 1 living room • 1 bathroom,8.5,https://www.booking.com/hotel/es/valencia-town-center-new-apartments.en-gb.html?label=gen173nr-1FCAEoggI46AdICVgEaEaIAQGYAQm4AQfIAQ_YAQHoAQH4AQKIAgGoAgO4Ar2yua0GwAIB0gIkOTA3YTVlNDAtNjVmOS00MmQyLWFjZGMtZDdiMWYwOTg3MmE42AIF4AIB&aid=304142&ucfs=1&arphpl=1&checkin=2024-02-23&checkout=2024-03-03&dest_id=-406131&dest_type=city&group_adults=2&req_adults=2&no_rooms=1&group_children=0&req_children=0&hpos=9&hapos=284&sr_order=popularity&srpvid=689554a7c1b004a5&srepoch=1705925005&all_sr_blocks=465275003_143045403_2_0_0&highlighted_blocks=465275003_143045403_2_0_0&matching_block_id=465275003_143045403_2_0_0&sr_pri_blocks=465275003_143045403_2_0_0__96570&from=searchresults#hotelTmpl,"In the Extramurs district of Valencia, close to Church of Saint Nicolás, Valencia Town Center New Apartments has free WiFi and a washing machine. It is set 400 metres from Norte Train Station and offers a lift. Jardines de Monforte is 4 km away and Bioparc Valencia is 4.5 km from the apartment.

Accessible via private entrance, all units have air conditioning, soundproofing, wardrobe and a private bathroom with a shower. Some units also have a well-fitted kitchen equipped with a microwave, a stovetop, and kitchenware. At the apartment complex, some units are fitted with a coffee machine and chocolates or cookies.

Sightseeing tours are available within easy reach.

Popular points of interest near the apartment include Turia Gardens, González Martí National Museum of Ceramics and Decorative Arts and Basilica de la Virgen de los Desamparados. The nearest airport is Valencia Airport, 8 km from Valencia Town Center New Apartments."
285,Valencia,2024-02-23,2024-03-03,La Ventolera,"€ 1,007",Entire apartment • 2 bedrooms • 1 bathroom • 70m²,8.6,https://www.booking.com/hotel/es/la-ventolera.en-gb.html?label=gen173nr-1FCAEoggI46AdICVgEaEaIAQGYAQm4AQfIAQ_YAQHoAQH4AQKIAgGoAgO4Ar2yua0GwAIB0gIkOTA3YTVlNDAtNjVmOS00MmQyLWFjZGMtZDdiMWYwOTg3MmE42AIF4AIB&aid=304142&ucfs=1&arphpl=1&checkin=2024-02-23&checkout=2024-03-03&dest_id=-406131&dest_type=city&group_adults=2&req_adults=2&no_rooms=1&group_children=0&req_children=0&hpos=10&hapos=285&sr_order=popularity&srpvid=689554a7c1b004a5&srepoch=1705925005&all_sr_blocks=785683401_338097180_4_0_0&highlighted_blocks=785683401_338097180_4_0_0&matching_block_id=785683401_338097180_4_0_0&sr_pri_blocks=785683401_338097180_4_0_0__100700&from=searchresults#hotelTmpl,"Located in Valencia, La Ventolera provides accommodation with private pool, free WiFi and free private parking for guests who drive. The property is situated 45 km from L'Oceanografic, 47 km from Bioparc Valencia and 48 km from Church of Saint Nicolás. Norte Train Station is 48 km away and Basilica de la Virgen de los Desamparados is 49 km from the apartment.

Providing a terrace, this apartment also offers a flat-screen TV, a fully equipped kitchen and 1 bathroom.

Jardines de Monforte is 49 km from the apartment, while Turia Gardens is 49 km away. The nearest airport is Valencia Airport, 39 km from La Ventolera."
286,Valencia,2024-02-23,2024-03-03,Las Artes Hlius Luxury Apartments,"€ 1,493",Entire apartment • 1 bedroom • 1 living room • 1 bathroom • 1 kitchen • 52m²,9.8,https://www.booking.com/hotel/es/las-artes-hlius-luxury-apartments.en-gb.html?label=gen173nr-1FCAEoggI46AdICVgEaEaIAQGYAQm4AQfIAQ_YAQHoAQH4AQKIAgGoAgO4Ar2yua0GwAIB0gIkOTA3YTVlNDAtNjVmOS00MmQyLWFjZGMtZDdiMWYwOTg3MmE42AIF4AIB&aid=304142&ucfs=1&arphpl=1&checkin=2024-02-23&checkout=2024-03-03&dest_id=-406131&dest_type=city&group_adults=2&req_adults=2&no_rooms=1&group_children=0&req_children=0&hpos=11&hapos=286&sr_order=popularity&srpvid=689554a7c1b004a5&srepoch=1705925005&all_sr_blocks=1053621501_386938694_6_0_0&highlighted_blocks=1053621501_386938694_6_0_0&matching_block_id=1053621501_386938694_6_0_0&sr_pri_blocks=1053621501_386938694_6_0_0__149328&from=searchresults#hotelTmpl,"Set in Valencia, 2.9 km from Norte Train Station and 3.3 km from Turia Gardens, Las Artes Hlius Luxury Apartments offers air conditioning. The property is located 3.8 km from Puerto de Valencia, 4 km from Jardines de Monforte and 4.1 km from González Martí National Museum of Ceramics and Decorative Arts. Free WiFi is available throughout the property and L'Oceanografic is 1.7 km away.

The 1-bedroom apartment has a living room with a flat-screen TV with streaming services, a fully equipped kitchen with a microwave and a toaster, and 1 bathroom with a hair dryer. Towels and bed linen are offered in the apartment. For added privacy, the accommodation has a private entrance and soundproofing.

Basilica de la Virgen de los Desamparados is 4.2 km from the apartment, while Church of Saint Nicolás is 5.1 km from the property. The nearest airport is Valencia Airport, 10 km from Las Artes Hlius Luxury Apartments."
287,Valencia,2024-02-23,2024-03-03,MD Design Hotel - Portal del Real,"€ 2,074",,8.7,https://www.booking.com/hotel/es/md-design-portal-del-real.en-gb.html?label=gen173nr-1FCAEoggI46AdICVgEaEaIAQGYAQm4AQfIAQ_YAQHoAQH4AQKIAgGoAgO4Ar2yua0GwAIB0gIkOTA3YTVlNDAtNjVmOS00MmQyLWFjZGMtZDdiMWYwOTg3MmE42AIF4AIB&aid=304142&ucfs=1&arphpl=1&checkin=2024-02-23&checkout=2024-03-03&dest_id=-406131&dest_type=city&group_adults=2&req_adults=2&no_rooms=1&group_children=0&req_children=0&hpos=12&hapos=287&sr_order=popularity&srpvid=689554a7c1b004a5&srepoch=1705925005&all_sr_blocks=239168501_101473826_2_0_0&highlighted_blocks=239168501_101473826_2_0_0&matching_block_id=239168501_101473826_2_0_0&sr_pri_blocks=239168501_101473826_2_0_0__207383&from_sustainable_property_sr=1&from=searchresults#hotelTmpl,"Set in Valencia, less than 1 km from Jardines de Monforte, MD Design Hotel - Portal del Real features views of the city. Featuring a terrace, the 2-star hotel has air-conditioned rooms with free WiFi, each with a private bathroom. The property is 300 metres from Basilica de la Virgen de los Desamparados, and within 500 metres of the city centre.

All guest rooms come with a flat-screen TV with satellite channels, fridge, a kettle, a shower, free toiletries and a wardrobe. At the hotel all rooms include bed linen and towels.

Speaking English, Spanish, Italian and Russian at the 24-hour front desk, staff are ready to help around the clock.

Popular points of interest near MD Design Hotel - Portal del Real include Turia Gardens, González Martí National Museum of Ceramics and Decorative Arts and Norte Train Station. The nearest airport is Valencia, 10 km from the accommodation, and the property offers a paid airport shuttle service."
