,place,start_date,end_date,name,price,description_short,rating,url,description
424,Valencia,2024-02-23,2024-03-03,El Mosaico Apartment,€ 886,Entire apartment • 1 bedroom • 1 living room • 2 bathrooms • 1 kitchen • 65m²,7.6,https://www.booking.com/hotel/es/el-mosaico-apartment-best-apartments-valencia.en-gb.html?label=gen173nr-1FCAEoggI46AdICVgEaEaIAQGYAQm4AQfIAQ_YAQHoAQH4AQKIAgGoAgO4Ar2yua0GwAIB0gIkOTA3YTVlNDAtNjVmOS00MmQyLWFjZGMtZDdiMWYwOTg3MmE42AIF4AIB&aid=304142&ucfs=1&arphpl=1&checkin=2024-02-23&checkout=2024-03-03&dest_id=-406131&dest_type=city&group_adults=2&req_adults=2&no_rooms=1&group_children=0&req_children=0&hpos=24&hapos=424&sr_order=popularity&srpvid=689554a7c1b004a5&srepoch=1705925031&all_sr_blocks=981308401_370406586_3_0_0&highlighted_blocks=981308401_370406586_3_0_0&matching_block_id=981308401_370406586_3_0_0&sr_pri_blocks=981308401_370406586_3_0_0__88592&from=searchresults#hotelTmpl,"El Mosaico Apartment is located in the Patraix district of Valencia, 1.5 km from Norte Train Station, 3.6 km from Bioparc Valencia and 3.7 km from Turia Gardens. The property is set 3.8 km from González Martí National Museum of Ceramics and Decorative Arts, 3.9 km from Basilica de la Virgen de los Desamparados and 4.3 km from Jardines de Monforte. Free WiFi is available throughout the property and Church of Saint Nicolás is 2.5 km away.

The air-conditioned apartment consists of 1 bedroom, a living room, a fully equipped kitchen with an oven and a coffee machine, and 2 bathrooms with a walk-in shower and a hair dryer. Towels and bed linen are provided in the apartment. For added privacy, the accommodation features a private entrance.

L'Oceanografic is 5.7 km from the apartment, while Puerto de Valencia is 6.4 km away. The nearest airport is Valencia, 7 km from El Mosaico Apartment, and the property offers a paid airport shuttle service."
425,Valencia,2024-02-23,2024-03-03,Ciudad y playa desde un barco.,"€ 1,516",Entire holiday home • 3 bedrooms • 2 bathrooms • 1 kitchen • 25m²,8.5,https://www.booking.com/hotel/es/ciudad-y-playa-desde-un-barco.en-gb.html?label=gen173nr-1FCAEoggI46AdICVgEaEaIAQGYAQm4AQfIAQ_YAQHoAQH4AQKIAgGoAgO4Ar2yua0GwAIB0gIkOTA3YTVlNDAtNjVmOS00MmQyLWFjZGMtZDdiMWYwOTg3MmE42AIF4AIB&aid=304142&ucfs=1&arphpl=1&checkin=2024-02-23&checkout=2024-03-03&dest_id=-406131&dest_type=city&group_adults=2&req_adults=2&no_rooms=1&group_children=0&req_children=0&hpos=25&hapos=425&sr_order=popularity&srpvid=689554a7c1b004a5&srepoch=1705925031&all_sr_blocks=1100592701_383012699_4_0_0&highlighted_blocks=1100592701_383012699_4_0_0&matching_block_id=1100592701_383012699_4_0_0&sr_pri_blocks=1100592701_383012699_4_0_0__151610&from=searchresults#hotelTmpl,"Boasting city views, Ciudad y playa desde un barco. Features accommodation with a balcony, around 300 metres from Playa de las Arenas. The property is around 1.7 km from Malvarrosa Beach, 2.9 km from Patacona Beach and 1 km from Puerto de Valencia. Jardines de Monforte is 5.4 km away and Norte Train Station is 6 km from the boat.

This boat has 3 bedrooms, a kitchen with an oven and a fridge, a flat-screen TV, a seating area and 2 bathrooms fitted with a bidet. Guests can take in the views of the sea from the terrace, which also has outdoor furniture. For added privacy, the accommodation features a private entrance.

Dining options are available close to the boat.

L'Oceanografic is 3.2 km from Ciudad y playa desde un barco., while Turia Gardens is 5.2 km from the property. The nearest airport is Valencia Airport, 14 km from the accommodation."
426,Valencia,2024-02-23,2024-03-03,Amazing Apartment with aFun and Friendly Atmosphere,"€ 1,796",Entire apartment • 1 bedroom • 1 living room • 1 bathroom • 1 kitchen • 70m²,,https://www.booking.com/hotel/es/amazing-apartment-with-afun-and-friendly-atmosphere.en-gb.html?label=gen173nr-1FCAEoggI46AdICVgEaEaIAQGYAQm4AQfIAQ_YAQHoAQH4AQKIAgGoAgO4Ar2yua0GwAIB0gIkOTA3YTVlNDAtNjVmOS00MmQyLWFjZGMtZDdiMWYwOTg3MmE42AIF4AIB&aid=304142&ucfs=1&arphpl=1&checkin=2024-02-23&checkout=2024-03-03&dest_id=-406131&dest_type=city&group_adults=2&req_adults=2&no_rooms=1&group_children=0&req_children=0&hpos=1&hapos=426&sr_order=popularity&srpvid=689554a7c1b004a5&srepoch=1705925036&all_sr_blocks=1048385002_380307473_2_0_0&highlighted_blocks=1048385002_380307473_2_0_0&matching_block_id=1048385002_380307473_2_0_0&sr_pri_blocks=1048385002_380307473_2_0_0__179642&from=searchresults#hotelTmpl,"Situated in Valencia, 1 km from Basilica de la Virgen de los Desamparados and 1.8 km from Turia Gardens, Amazing Apartment with aFun and Friendly Atmosphere offers air conditioning. It is located 1.4 km from Jardines de Monforte and features a lift. Free WiFi is available throughout the property and Church of Saint Nicolás is 1.2 km away.

The spacious apartment features 1 separate bedroom, 1 bathroom, a fully equipped kitchen with a dining area and dishwasher, and a living room with a TV. Towels and bed linen are available in the apartment. The accommodation is non-smoking.

González Martí National Museum of Ceramics and Decorative Arts is 1.5 km from the apartment, while Norte Train Station is 4 km from the property. The nearest airport is Valencia Airport, 9 km from Amazing Apartment with aFun and Friendly Atmosphere."
427,Valencia,2024-02-23,2024-03-03,MD Balmes Central Market,"€ 1,516",Entire apartment • 2 bedrooms • 1 living room • 1 bathroom • 1 kitchen • 60m²,6.5,https://www.booking.com/hotel/es/balmes-1-6-pax-terrace-very-close-to-the-central-market.en-gb.html?label=gen173nr-1FCAEoggI46AdICVgEaEaIAQGYAQm4AQfIAQ_YAQHoAQH4AQKIAgGoAgO4Ar2yua0GwAIB0gIkOTA3YTVlNDAtNjVmOS00MmQyLWFjZGMtZDdiMWYwOTg3MmE42AIF4AIB&aid=304142&ucfs=1&arphpl=1&checkin=2024-02-23&checkout=2024-03-03&dest_id=-406131&dest_type=city&group_adults=2&req_adults=2&no_rooms=1&group_children=0&req_children=0&hpos=2&hapos=427&sr_order=popularity&srpvid=689554a7c1b004a5&srepoch=1705925036&all_sr_blocks=676006903_276099854_0_0_0&highlighted_blocks=676006903_276099854_0_0_0&matching_block_id=676006903_276099854_0_0_0&sr_pri_blocks=676006903_276099854_0_0_0__151600&from_sustainable_property_sr=1&from=searchresults#hotelTmpl,"Set in Valencia centre, 500 metres from Church of Saint Nicolás and 1 km from Norte Train Station, MD Balmes Central Market offers accommodation with free WiFi and a balcony. This sustainable apartment is located less than 1 km from Basilica de la Virgen de los Desamparados and 1.9 km from Jardines de Monforte. The apartment has family rooms.

All units at the apartment complex come with air conditioning, a seating area, a flat-screen TV with streaming services, a kitchen, a dining area and a private bathroom with a hair dryer, a shower and free toiletries. An oven, a microwave and toaster are also offered, as well as a coffee machine and a kettle. At the apartment complex, units are fitted with bed linen and towels.

Sightseeing tours are available within easy reach of the property.

Popular points of interest near the apartment include Turia Gardens, González Martí National Museum of Ceramics and Decorative Arts and Valencia Silk Exchange. The nearest airport is Valencia Airport, 8 km from MD Balmes Central Market."
428,Valencia,2024-02-23,2024-03-03,BRAND NEW apartment with private open-air space,"€ 1,603",Entire apartment • 3 bedrooms • 1 living room • 2 bathrooms • 1 kitchen • 120m²,8.4,https://www.booking.com/hotel/es/brand-new-apartment-with-private-open-air-space.en-gb.html?label=gen173nr-1FCAEoggI46AdICVgEaEaIAQGYAQm4AQfIAQ_YAQHoAQH4AQKIAgGoAgO4Ar2yua0GwAIB0gIkOTA3YTVlNDAtNjVmOS00MmQyLWFjZGMtZDdiMWYwOTg3MmE42AIF4AIB&aid=304142&ucfs=1&arphpl=1&checkin=2024-02-23&checkout=2024-03-03&dest_id=-406131&dest_type=city&group_adults=2&req_adults=2&no_rooms=1&group_children=0&req_children=0&hpos=3&hapos=428&sr_order=popularity&srpvid=689554a7c1b004a5&srepoch=1705925036&all_sr_blocks=831111402_355947018_2_0_0&highlighted_blocks=831111402_355947018_2_0_0&matching_block_id=831111402_355947018_2_0_0&sr_pri_blocks=831111402_355947018_2_0_0__160348&from=searchresults#hotelTmpl,"Featuring accommodation with a terrace, BRAND NEW apartment with private open-air space is located in Valencia. It is set 3.7 km from Church of Saint Nicolás and provides a lift. Free WiFi is available throughout the property and Norte Train Station is 1.8 km away.

The air-conditioned apartment consists of 3 bedrooms, a living room, a fully equipped kitchen with a dishwasher and a coffee machine, and 2 bathrooms with a bidet and a hair dryer. Towels and bed linen are provided in the apartment. The accommodation is non-smoking.

Turia Gardens is 4.2 km from the apartment, while González Martí National Museum of Ceramics and Decorative Arts is 4.3 km away. The nearest airport is Valencia Airport, 8 km from BRAND NEW apartment with private open-air space."
429,Valencia,2024-02-23,2024-03-03,Grandera Apart's - Cervero 24A,"€ 1,018",Entire apartment • 2 bedrooms • 1 living room • 1 bathroom • 1 kitchen • 55m²,8.9,https://www.booking.com/hotel/es/salvador-cervero-24-valencia.en-gb.html?label=gen173nr-1FCAEoggI46AdICVgEaEaIAQGYAQm4AQfIAQ_YAQHoAQH4AQKIAgGoAgO4Ar2yua0GwAIB0gIkOTA3YTVlNDAtNjVmOS00MmQyLWFjZGMtZDdiMWYwOTg3MmE42AIF4AIB&aid=304142&ucfs=1&arphpl=1&checkin=2024-02-23&checkout=2024-03-03&dest_id=-406131&dest_type=city&group_adults=2&req_adults=2&no_rooms=1&group_children=0&req_children=0&hpos=4&hapos=429&sr_order=popularity&srpvid=689554a7c1b004a5&srepoch=1705925036&all_sr_blocks=1071663403_381886513_6_0_0&highlighted_blocks=1071663403_381886513_6_0_0&matching_block_id=1071663403_381886513_6_0_0&sr_pri_blocks=1071663403_381886513_6_0_0__101800&from_sustainable_property_sr=1&from=searchresults#hotelTmpl,"Located in Valencia, 4.2 km from Church of Saint Nicolás, Grandera Apart's - Cervero 24A provides air-conditioned rooms with free WiFi and express check-in and check-out. There is a private entrance at the aparthotel for the convenience of those who stay. The aparthotel features family rooms.

Each unit is equipped with a fully equipped kitchen with a microwave, a seating area, a flat-screen TV, a washing machine, and a private bathroom with shower and a hair dryer. A fridge, a stovetop and kitchenware are also provided, as well as a coffee machine and a kettle. The units include bed linen.

Basilica de la Virgen de los Desamparados is 4.3 km from the aparthotel, while Turia Gardens is 4.4 km away. The nearest airport is Valencia Airport, 12 km from Grandera Apart's - Cervero 24A."
430,Valencia,2024-02-23,2024-03-03,Reinapart Patacona Beach 46,"€ 1,609",Entire apartment • 1 bedroom • 1 living room • 1 bathroom • 1 kitchen • 40m²,9.5,https://www.booking.com/hotel/es/reinapart-patacona-beach.en-gb.html?label=gen173nr-1FCAEoggI46AdICVgEaEaIAQGYAQm4AQfIAQ_YAQHoAQH4AQKIAgGoAgO4Ar2yua0GwAIB0gIkOTA3YTVlNDAtNjVmOS00MmQyLWFjZGMtZDdiMWYwOTg3MmE42AIF4AIB&aid=304142&ucfs=1&arphpl=1&checkin=2024-02-23&checkout=2024-03-03&dest_id=-406131&dest_type=city&group_adults=2&req_adults=2&no_rooms=1&group_children=0&req_children=0&hpos=5&hapos=430&sr_order=popularity&srpvid=689554a7c1b004a5&srepoch=1705925036&all_sr_blocks=861433702_371049951_3_0_0&highlighted_blocks=861433702_371049951_3_0_0&matching_block_id=861433702_371049951_3_0_0&sr_pri_blocks=861433702_371049951_3_0_0__160920&from=searchresults#hotelTmpl,"Featuring private pool, Reinapart Patacona Beach 46 is located on the beachfront in Valencia. Free WiFi is provided throughout the property and private parking is available on site. Boasting family rooms, this property also provides guests with a terrace.

The units in the apartment complex are equipped with air conditioning, a seating area, a flat-screen TV with streaming services, a kitchen, a dining area and a private bathroom with a hair dryer, a walk-in shower and a bidet. An oven, a microwave and toaster are also featured, as well as a coffee machine. Additional in-room amenities include wine or champagne.

The apartment also provides an indoor pool and a fitness centre for guests to relax in.

Popular points of interest near Reinapart Patacona Beach 46 include Patacona Beach, Malvarrosa Beach and Port Saplaya Beach. The nearest airport is Valencia Airport, 17 km from the accommodation."
431,Valencia,2024-02-23,2024-03-03,Velero en club náutico valencia mar,"€ 1,539",Mobile home • 3 bedrooms • 1 living room • 2 bathrooms,9.8,https://www.booking.com/hotel/es/velero-en-club-nautico-valencia-mar.en-gb.html?label=gen173nr-1FCAEoggI46AdICVgEaEaIAQGYAQm4AQfIAQ_YAQHoAQH4AQKIAgGoAgO4Ar2yua0GwAIB0gIkOTA3YTVlNDAtNjVmOS00MmQyLWFjZGMtZDdiMWYwOTg3MmE42AIF4AIB&aid=304142&ucfs=1&arphpl=1&checkin=2024-02-23&checkout=2024-03-03&dest_id=-406131&dest_type=city&group_adults=2&req_adults=2&no_rooms=1&group_children=0&req_children=0&hpos=6&hapos=431&sr_order=popularity&srpvid=689554a7c1b004a5&srepoch=1705925036&all_sr_blocks=1073344001_379882113_6_0_0&highlighted_blocks=1073344001_379882113_6_0_0&matching_block_id=1073344001_379882113_6_0_0&sr_pri_blocks=1073344001_379882113_6_0_0__153900&from=searchresults#hotelTmpl,"Velero en club náutico valencia mar, a property with a garden and a bar, is located in Valencia, 6.4 km from Puerto de Valencia, 7.7 km from Turia Gardens, as well as 8.4 km from Jardines de Monforte. This property offers access to a terrace, free private parking and free WiFi. The property is non-smoking and is situated 5.7 km from L'Oceanografic.

Towels and bed linen are available in the boat.

González Martí National Museum of Ceramics and Decorative Arts is 8.5 km from the boat, while Norte Train Station is 8.5 km from the property. The nearest airport is Valencia Airport, 15 km from Velero en club náutico valencia mar."
432,Valencia,2024-02-23,2024-03-03,Blasco Ibáñez Valencia Double Room with Private Bathroom in Shared Apartment,€ 594,,5.8,https://www.booking.com/hotel/es/blasco-ibanez-valencia-double-room-with-private-bathroom.en-gb.html?label=gen173nr-1FCAEoggI46AdICVgEaEaIAQGYAQm4AQfIAQ_YAQHoAQH4AQKIAgGoAgO4Ar2yua0GwAIB0gIkOTA3YTVlNDAtNjVmOS00MmQyLWFjZGMtZDdiMWYwOTg3MmE42AIF4AIB&aid=304142&ucfs=1&arphpl=1&checkin=2024-02-23&checkout=2024-03-03&dest_id=-406131&dest_type=city&group_adults=2&req_adults=2&no_rooms=1&group_children=0&req_children=0&hpos=7&hapos=432&sr_order=popularity&srpvid=689554a7c1b004a5&srepoch=1705925036&all_sr_blocks=1031237801_375783743_2_0_0&highlighted_blocks=1031237801_375783743_2_0_0&matching_block_id=1031237801_375783743_2_0_0&sr_pri_blocks=1031237801_375783743_2_0_0__59400&from=searchresults#hotelTmpl,"Blasco Ibáñez Valencia Double Room with Private Bathroom in Shared Apartment is situated in the Algiros district of Valencia, 2.9 km from Patacona Beach, 2.8 km from Turia Gardens and 3.1 km from Jardines de Monforte. It is located 2.1 km from Playa de las Arenas and provides a lift. Free WiFi is available throughout the property and Malvarrosa Beach is 2.1 km away.

The homestay is equipped with a flat-screen TV. The accommodation is non-smoking.

Puerto de Valencia is 3.5 km from the homestay, while González Martí National Museum of Ceramics and Decorative Arts is 3.6 km away. The nearest airport is Valencia Airport, 11 km from Blasco Ibáñez Valencia Double Room with Private Bathroom in Shared Apartment."
433,Valencia,2024-02-23,2024-03-03,"Your home at Valencia, Marina Real","€ 1,659",Entire apartment • 3 bedrooms • 2 bathrooms • 1 kitchen • 150m²,8.8,https://www.booking.com/hotel/es/your-home-at-valencia-marina-real.en-gb.html?label=gen173nr-1FCAEoggI46AdICVgEaEaIAQGYAQm4AQfIAQ_YAQHoAQH4AQKIAgGoAgO4Ar2yua0GwAIB0gIkOTA3YTVlNDAtNjVmOS00MmQyLWFjZGMtZDdiMWYwOTg3MmE42AIF4AIB&aid=304142&ucfs=1&arphpl=1&checkin=2024-02-23&checkout=2024-03-03&dest_id=-406131&dest_type=city&group_adults=2&req_adults=2&no_rooms=1&group_children=0&req_children=0&hpos=8&hapos=433&sr_order=popularity&srpvid=689554a7c1b004a5&srepoch=1705925036&all_sr_blocks=762781001_333380319_2_0_0&highlighted_blocks=762781001_333380319_2_0_0&matching_block_id=762781001_333380319_2_0_0&sr_pri_blocks=762781001_333380319_2_0_0__165935&from=searchresults#hotelTmpl,"Set in Valencia, 800 metres from Playa de las Arenas and 1.9 km from Malvarrosa Beach, Your home at Valencia, Marina Real offers air conditioning. The property is around 500 metres from Puerto de Valencia, 3.4 km from L'Oceanografic and 4.4 km from Turia Gardens. The property is non-smoking and is situated 2.8 km from Patacona Beach.

The spacious apartment has 3 bedrooms, 2 bathrooms, bed linen, towels, a flat-screen TV, a fully equipped kitchen, and a balcony with sea views.

Jardines de Monforte is 4.6 km from the apartment, while Norte Train Station is 5.2 km from the property. The nearest airport is Valencia Airport, 14 km from Your home at Valencia, Marina Real."
434,Valencia,2024-02-23,2024-03-03,Apartamento cómodo y espacioso con parking,"€ 1,486",Entire apartment • 3 bedrooms • 1 living room • 2 bathrooms • 1 kitchen • 85m²,8.9,https://www.booking.com/hotel/es/apartamento-comodo-y-espacioso-con-parking-valencia2.en-gb.html?label=gen173nr-1FCAEoggI46AdICVgEaEaIAQGYAQm4AQfIAQ_YAQHoAQH4AQKIAgGoAgO4Ar2yua0GwAIB0gIkOTA3YTVlNDAtNjVmOS00MmQyLWFjZGMtZDdiMWYwOTg3MmE42AIF4AIB&aid=304142&ucfs=1&arphpl=1&checkin=2024-02-23&checkout=2024-03-03&dest_id=-406131&dest_type=city&group_adults=2&req_adults=2&no_rooms=1&group_children=0&req_children=0&hpos=9&hapos=434&sr_order=popularity&srpvid=689554a7c1b004a5&srepoch=1705925036&all_sr_blocks=1025155701_378845766_2_0_0&highlighted_blocks=1025155701_378845766_2_0_0&matching_block_id=1025155701_378845766_2_0_0&sr_pri_blocks=1025155701_378845766_2_0_0__148560&from=searchresults#hotelTmpl,"Situated in Valencia, 4.5 km from Norte Train Station and 5 km from Church of Saint Nicolás, Apartamento cómodo y espacioso con parking offers air conditioning. It is located 5.3 km from L'Oceanografic and provides a lift. The apartment also features free WiFi, free private parking and facilities for disabled guests.

The 3-bedroom apartment has a living room with a flat-screen TV, a fully equipped kitchen with a dishwasher and an oven, and 2 bathrooms with a hair dryer. Towels and bed linen are available in the apartment.

Turia Gardens is 5.6 km from the apartment, while González Martí National Museum of Ceramics and Decorative Arts is 5.7 km from the property. The nearest airport is Valencia Airport, 9 km from Apartamento cómodo y espacioso con parking."
435,Valencia,2024-02-23,2024-03-03,Beautiful Suite with Private Terrace,"€ 1,866",Entire apartment • 1 bedroom • 1 living room • 1 bathroom • 1 kitchen • 70m²,5.5,https://www.booking.com/hotel/es/beautiful-suite-with-private-terrace.en-gb.html?label=gen173nr-1FCAEoggI46AdICVgEaEaIAQGYAQm4AQfIAQ_YAQHoAQH4AQKIAgGoAgO4Ar2yua0GwAIB0gIkOTA3YTVlNDAtNjVmOS00MmQyLWFjZGMtZDdiMWYwOTg3MmE42AIF4AIB&aid=304142&ucfs=1&arphpl=1&checkin=2024-02-23&checkout=2024-03-03&dest_id=-406131&dest_type=city&group_adults=2&req_adults=2&no_rooms=1&group_children=0&req_children=0&hpos=10&hapos=435&sr_order=popularity&srpvid=689554a7c1b004a5&srepoch=1705925036&all_sr_blocks=1048360602_380293651_2_0_0&highlighted_blocks=1048360602_380293651_2_0_0&matching_block_id=1048360602_380293651_2_0_0&sr_pri_blocks=1048360602_380293651_2_0_0__186587&from=searchresults#hotelTmpl,"Situated in Valencia, 1.2 km from Church of Saint Nicolás and 1 km from Basilica de la Virgen de los Desamparados, Beautiful Suite with Private Terrace offers air conditioning. It is set 1.4 km from Jardines de Monforte and features a lift. The property is non-smoking and is located 1.8 km from Turia Gardens.

The spacious apartment features 1 separate bedroom, 1 bathroom, a fully equipped kitchen with a dining area and dishwasher, and a living room with a TV. Towels and bed linen are available in the apartment.

González Martí National Museum of Ceramics and Decorative Arts is 1.5 km from the apartment, while Norte Train Station is 4 km from the property. The nearest airport is Valencia Airport, 9 km from Beautiful Suite with Private Terrace."
436,Valencia,2024-02-23,2024-03-03,Marin Beach Apartment Malvarrosa,"€ 2,051",Entire apartment • 3 bedrooms • 1 living room • 2 bathrooms • 1 kitchen • 118m²,9.6,https://www.booking.com/hotel/es/marin-beach-apartment-malvarossa.en-gb.html?label=gen173nr-1FCAEoggI46AdICVgEaEaIAQGYAQm4AQfIAQ_YAQHoAQH4AQKIAgGoAgO4Ar2yua0GwAIB0gIkOTA3YTVlNDAtNjVmOS00MmQyLWFjZGMtZDdiMWYwOTg3MmE42AIF4AIB&aid=304142&ucfs=1&arphpl=1&checkin=2024-02-23&checkout=2024-03-03&dest_id=-406131&dest_type=city&group_adults=2&req_adults=2&no_rooms=1&group_children=0&req_children=0&hpos=11&hapos=436&sr_order=popularity&srpvid=689554a7c1b004a5&srepoch=1705925036&all_sr_blocks=1001802801_372976293_2_0_0&highlighted_blocks=1001802801_372976293_2_0_0&matching_block_id=1001802801_372976293_2_0_0&sr_pri_blocks=1001802801_372976293_2_0_0__205075&from_sustainable_property_sr=1&from=searchresults#hotelTmpl,"Marin Beach Apartment Malvarrosa is a beachfront apartment in Valencia, offering guests a sustainable accommodation with scenic sea views. The air-conditioned accommodation is 600 metres from Patacona Beach. Free WiFi is available throughout the property and Malvarrosa Beach is 300 metres away.

The spacious apartment with a patio and city views has 3 bedrooms, a living room, a flat-screen TV, an equipped kitchen with an oven and a toaster, and 2 bathrooms with a walk-in shower. Towels and bed linen are available in the apartment. For added privacy, the accommodation has a private entrance and soundproofing.

Playa de las Arenas is less than 1 km from the apartment, while Puerto de Valencia is 3.1 km from the property. The nearest airport is Valencia Airport, 14 km from Marin Beach Apartment Malvarrosa."
437,Valencia,2024-02-23,2024-03-03,El Huerto,€ 923,Entire chalet • 1 bedroom • 1 living room • 1 bathroom • 1 kitchen • 80m²,7.5,https://www.booking.com/hotel/es/el-huerto-valencia.en-gb.html?label=gen173nr-1FCAEoggI46AdICVgEaEaIAQGYAQm4AQfIAQ_YAQHoAQH4AQKIAgGoAgO4Ar2yua0GwAIB0gIkOTA3YTVlNDAtNjVmOS00MmQyLWFjZGMtZDdiMWYwOTg3MmE42AIF4AIB&aid=304142&ucfs=1&arphpl=1&checkin=2024-02-23&checkout=2024-03-03&dest_id=-406131&dest_type=city&group_adults=2&req_adults=2&no_rooms=1&group_children=0&req_children=0&hpos=12&hapos=437&sr_order=popularity&srpvid=689554a7c1b004a5&srepoch=1705925036&all_sr_blocks=1068745601_379367272_2_0_0&highlighted_blocks=1068745601_379367272_2_0_0&matching_block_id=1068745601_379367272_2_0_0&sr_pri_blocks=1068745601_379367272_2_0_0__92332&from=searchresults#hotelTmpl,"Featuring a garden, private pool and garden views, El Huerto is set in Valencia. This property offers access to a terrace, ping-pong, free private parking and free WiFi. The property is non-smoking and is situated less than 1 km from Playa de Xeraco Beach.

The spacious chalet is fitted with 1 bedroom, a flat-screen TV and a fully equipped kitchen that provides guests with a dishwasher, an oven, a washing machine, a microwave and a toaster. Towels and bed linen are featured in the chalet. The accommodation offers a fireplace.

Guests can take advantage of the warm weather with the property's barbecue facilities.

You can play darts at the chalet, and the area is popular for hiking. Kids pool is also available for guests at El Huerto.

Platja Tavernes de la Valldigna is 2 km from the accommodation, while L’ahuir is 2.4 km away. The nearest airport is Valencia Airport, 65 km from El Huerto."
438,Valencia,2024-02-23,2024-03-03,"Modern, Stylish Apartment with balcony","€ 1,449",Entire apartment • 3 bedrooms • 1 living room • 2 bathrooms • 1 kitchen • 120m²,8.5,https://www.booking.com/hotel/es/modern-stylish-apartment-with-balcony.en-gb.html?label=gen173nr-1FCAEoggI46AdICVgEaEaIAQGYAQm4AQfIAQ_YAQHoAQH4AQKIAgGoAgO4Ar2yua0GwAIB0gIkOTA3YTVlNDAtNjVmOS00MmQyLWFjZGMtZDdiMWYwOTg3MmE42AIF4AIB&aid=304142&ucfs=1&arphpl=1&checkin=2024-02-23&checkout=2024-03-03&dest_id=-406131&dest_type=city&group_adults=2&req_adults=2&no_rooms=1&group_children=0&req_children=0&hpos=13&hapos=438&sr_order=popularity&srpvid=689554a7c1b004a5&srepoch=1705925036&all_sr_blocks=935838102_365717948_2_0_0&highlighted_blocks=935838102_365717948_2_0_0&matching_block_id=935838102_365717948_2_0_0&sr_pri_blocks=935838102_365717948_2_0_0__144913&from=searchresults#hotelTmpl,"Boasting accommodation with a balcony, Modern, Stylish Apartment with balcony is situated in Valencia. It is located 3.7 km from Church of Saint Nicolás and features a lift. Free WiFi is available throughout the property and Norte Train Station is 1.8 km away.

The air-conditioned apartment consists of 3 bedrooms, a living room, a fully equipped kitchen with a dishwasher and a coffee machine, and 2 bathrooms with a bidet and a hair dryer. Towels and bed linen are available in the apartment. The accommodation is non-smoking.

Turia Gardens is 4.2 km from the apartment, while González Martí National Museum of Ceramics and Decorative Arts is 4.3 km from the property. The nearest airport is Valencia Airport, 8 km from Modern, Stylish Apartment with balcony."
