,place,start_date,end_date,name,price,description_short,rating,url,description
134,Valencia,2024-02-23,2024-03-03,Vincci Mercat,"€ 2,529",,8.6,https://www.booking.com/hotel/es/vincci-mercat.en-gb.html?label=gen173nr-1FCAEoggI46AdICVgEaEaIAQGYAQm4AQfIAQ_YAQHoAQH4AQKIAgGoAgO4Ar2yua0GwAIB0gIkOTA3YTVlNDAtNjVmOS00MmQyLWFjZGMtZDdiMWYwOTg3MmE42AIF4AIB&aid=304142&ucfs=1&arphpl=1&checkin=2024-02-23&checkout=2024-03-03&dest_id=-406131&dest_type=city&group_adults=2&req_adults=2&no_rooms=1&group_children=0&req_children=0&hpos=9&hapos=134&sr_order=popularity&srpvid=689554a7c1b004a5&srepoch=1705924975&all_sr_blocks=127948410_333873943_0_2_0&highlighted_blocks=127948410_333873943_0_2_0&matching_block_id=127948410_333873943_0_2_0&sr_pri_blocks=127948410_333873943_0_2_0__252918&from_sustainable_property_sr=1&from=searchresults#hotelTmpl,"Featuring a restaurant and bar on site, Vincci Mercat is located in Valencia, less than 100 metres from the city’s Central Market. This hotel offers free Wi-Fi throughout and a rooftop terrace with a mini swimming pool and views of the old city.

Each air-conditioned room in this hotel has a flat-screen TV, wardrobe, safe, minibar. The private bathroom comes with a bath or shower, free toiletries, and a hairdryer.

You can find several restaurants and bars within a 5-minute walk of Vincci Mercat. Valencia Cathedral is 600 metres from the property, and the City of Arts and Sciences is 3 km away."
135,Valencia,2024-02-23,2024-03-03,Dau Studios,"€ 1,040",Entire apartment • 1 bedroom • 1 living room • 1 bathroom • 1 kitchen • 35m²,8.9,https://www.booking.com/hotel/es/dau-studios.en-gb.html?label=gen173nr-1FCAEoggI46AdICVgEaEaIAQGYAQm4AQfIAQ_YAQHoAQH4AQKIAgGoAgO4Ar2yua0GwAIB0gIkOTA3YTVlNDAtNjVmOS00MmQyLWFjZGMtZDdiMWYwOTg3MmE42AIF4AIB&aid=304142&ucfs=1&arphpl=1&checkin=2024-02-23&checkout=2024-03-03&dest_id=-406131&dest_type=city&group_adults=2&req_adults=2&no_rooms=1&group_children=0&req_children=0&hpos=10&hapos=135&sr_order=popularity&srpvid=689554a7c1b004a5&srepoch=1705924975&all_sr_blocks=741727501_329166772_2_0_0&highlighted_blocks=741727501_329166772_2_0_0&matching_block_id=741727501_329166772_2_0_0&sr_pri_blocks=741727501_329166772_2_0_0__103992&from_sustainable_property_sr=1&from=searchresults#hotelTmpl,"Surrounded by views of the city, Dau Studios is a sustainable apartment in Valencia, offering guests an environmentally friendly accommodation close to Playa de las Arenas. The property is around 2.2 km from Patacona Beach, 1.2 km from Puerto de Valencia and 4 km from L'Oceanografic. The property offers soundproof units and is set 1.1 km from Malvarrosa Beach.

The apartment complex will provide guests with air-conditioned units offering a wardrobe, a coffee machine, a dishwasher, a microwave, a safety deposit box, a flat-screen TV and a private bathroom with a shower. Free WiFi is available to all guests, while certain rooms here will provide you with a balcony. At the apartment complex, the units are equipped with bed linen and towels.

If you would rather not eat out, you can make use of the kitchen facilities, which include a toaster, kettle and a fridge.

A bicycle rental service is available at the apartment.

Turia Gardens is 5 km from Dau Studios, while Jardines de Monforte is 5.2 km away. The nearest airport is Valencia Airport, 14 km from the accommodation."
136,Valencia,2024-02-23,2024-03-03,"Piso familiar cerca del centro, AC y Wifi gratis (PA)",€ 660,Entire apartment • 2 bedrooms • 1 living room • 1 bathroom • 1 kitchen • 95m²,8.7,https://www.booking.com/hotel/es/piso-familiar-cerca-del-centro-ac-y-wifi-gratis-pa.en-gb.html?label=gen173nr-1FCAEoggI46AdICVgEaEaIAQGYAQm4AQfIAQ_YAQHoAQH4AQKIAgGoAgO4Ar2yua0GwAIB0gIkOTA3YTVlNDAtNjVmOS00MmQyLWFjZGMtZDdiMWYwOTg3MmE42AIF4AIB&aid=304142&ucfs=1&arphpl=1&checkin=2024-02-23&checkout=2024-03-03&dest_id=-406131&dest_type=city&group_adults=2&req_adults=2&no_rooms=1&group_children=0&req_children=0&hpos=11&hapos=136&sr_order=popularity&srpvid=689554a7c1b004a5&srepoch=1705924975&all_sr_blocks=1107693503_383551536_2_0_0&highlighted_blocks=1107693503_383551536_2_0_0&matching_block_id=1107693503_383551536_2_0_0&sr_pri_blocks=1107693503_383551536_2_0_0__66003&from=searchresults#hotelTmpl,"Piso familiar cerca del centro, AC y Wifi gratis (PA) has air-conditioned guest accommodation in Valencia, 3.1 km from Basilica de la Virgen de los Desamparados, 3.1 km from Jardines de Monforte and 3.2 km from Turia Gardens. The property is around 3.4 km from González Martí National Museum of Ceramics and Decorative Arts, 4 km from Bioparc Valencia and 4.5 km from Norte Train Station. Free WiFi is available throughout the property and Church of Saint Nicolás is 2.1 km away.

Each unit has a fully equipped kitchen with a dishwasher, a seating area, a flat-screen TV, a washing machine, and a private bathroom with shower and a hair dryer. An oven, a microwave and toaster are also offered, as well as a coffee machine and a kettle. At the apartment complex, units have bed linen and towels.

Puerto de Valencia is 6.7 km from the apartment, while L'Oceanografic is 6.9 km from the property. The nearest airport is Valencia Airport, 11 km from Piso familiar cerca del centro, AC y Wifi gratis (PA)."
137,Valencia,2024-02-23,2024-03-03,GuestReady - Mezzanine comfort in Valencia,€ 802,Entire apartment • 1 bedroom • 1 living room • 1 bathroom • 50m²,,https://www.booking.com/hotel/es/guestready-mezzanine-comfort-in-valencia.en-gb.html?label=gen173nr-1FCAEoggI46AdICVgEaEaIAQGYAQm4AQfIAQ_YAQHoAQH4AQKIAgGoAgO4Ar2yua0GwAIB0gIkOTA3YTVlNDAtNjVmOS00MmQyLWFjZGMtZDdiMWYwOTg3MmE42AIF4AIB&aid=304142&ucfs=1&arphpl=1&checkin=2024-02-23&checkout=2024-03-03&dest_id=-406131&dest_type=city&group_adults=2&req_adults=2&no_rooms=1&group_children=0&req_children=0&hpos=12&hapos=137&sr_order=popularity&srpvid=689554a7c1b004a5&srepoch=1705924975&all_sr_blocks=1139509401_386839087_2_0_0&highlighted_blocks=1139509401_386839087_2_0_0&matching_block_id=1139509401_386839087_2_0_0&sr_pri_blocks=1139509401_386839087_2_0_0__80158&from=searchresults#hotelTmpl,"Situated in Valencia, 1 km from Basilica de la Virgen de los Desamparados and 1.7 km from Turia Gardens, GuestReady - Mezzanine comfort in Valencia offers air conditioning. The property is set 4.6 km from Norte Train Station, 5.1 km from Bioparc Valencia and 5.9 km from Puerto de Valencia. Free WiFi is available throughout the property and Jardines de Monforte is 1.4 km away.

The apartment features 1 bedroom, 1 bathroom, bed linen, towels, a flat-screen TV with streaming services, a dining area, a fully equipped kitchenette, and a balcony with city views. For added privacy, the accommodation features a private entrance.

Popular points of interest near the apartment include Church of Saint Nicolás, González Martí National Museum of Ceramics and Decorative Arts and Serranos Towers. The nearest airport is Valencia Airport, 9 km from GuestReady - Mezzanine comfort in Valencia."
138,Valencia,2024-02-23,2024-03-03,Casa Mila,"€ 1,404",Entire apartment • 2 bedrooms • 1 bathroom • 60m²,9.5,https://www.booking.com/hotel/es/casa-mila-valencia1.en-gb.html?label=gen173nr-1FCAEoggI46AdICVgEaEaIAQGYAQm4AQfIAQ_YAQHoAQH4AQKIAgGoAgO4Ar2yua0GwAIB0gIkOTA3YTVlNDAtNjVmOS00MmQyLWFjZGMtZDdiMWYwOTg3MmE42AIF4AIB&aid=304142&ucfs=1&arphpl=1&checkin=2024-02-23&checkout=2024-03-03&dest_id=-406131&dest_type=city&group_adults=2&req_adults=2&no_rooms=1&group_children=0&req_children=0&hpos=13&hapos=138&sr_order=popularity&srpvid=689554a7c1b004a5&srepoch=1705924975&all_sr_blocks=967939401_369253837_4_0_0&highlighted_blocks=967939401_369253837_4_0_0&matching_block_id=967939401_369253837_4_0_0&sr_pri_blocks=967939401_369253837_4_0_0__140400&from=searchresults#hotelTmpl,"Situated in the centre of Valencia, 500 metres from Church of Saint Nicolás and less than 1 km from Basilica de la Virgen de los Desamparados, Casa Mila offers free WiFi, a terrace and air conditioning. With inner courtyard views, this accommodation features a balcony. The property is non-smoking and is set 2.5 km from Jardines de Monforte.

This apartment has 2 bedrooms, a kitchen, a flat-screen TV, a seating area and 1 bathroom with a shower. For added convenience, the property can provide towels and linens for a supplement.

Popular points of interest near the apartment include Turia Gardens, González Martí National Museum of Ceramics and Decorative Arts and Norte Train Station. The nearest airport is Valencia Airport, 8 km from Casa Mila."
139,Valencia,2024-02-23,2024-03-03,Helen Berger Boutique Hotel,"€ 2,944",,9.2,https://www.booking.com/hotel/es/helen-berger.en-gb.html?label=gen173nr-1FCAEoggI46AdICVgEaEaIAQGYAQm4AQfIAQ_YAQHoAQH4AQKIAgGoAgO4Ar2yua0GwAIB0gIkOTA3YTVlNDAtNjVmOS00MmQyLWFjZGMtZDdiMWYwOTg3MmE42AIF4AIB&aid=304142&ucfs=1&arphpl=1&checkin=2024-02-23&checkout=2024-03-03&dest_id=-406131&dest_type=city&group_adults=2&req_adults=2&no_rooms=1&group_children=0&req_children=0&hpos=14&hapos=139&sr_order=popularity&srpvid=689554a7c1b004a5&srepoch=1705924975&all_sr_blocks=515910501_368948826_2_2_0&highlighted_blocks=515910501_368948826_2_2_0&matching_block_id=515910501_368948826_2_2_0&sr_pri_blocks=515910501_368948826_2_2_0__294400&from_sustainable_property_sr=1&from=searchresults#hotelTmpl,"Conveniently set in the centre of Valencia, Helen Berger Boutique Hotel provides air-conditioned rooms, a restaurant, free WiFi and a bar. This 4-star hotel offers room service and a 24-hour front desk. The accommodation offers airport transfers, while a bicycle rental service is also available.

At the hotel, each room includes a desk, a flat-screen TV, a private bathroom, bed linen and towels. All rooms are equipped with a safety deposit box, while selected rooms are fitted with a terrace. Guest rooms will provide guests with a wardrobe and a kettle.

Popular points of interest near Helen Berger Boutique Hotel include González Martí National Museum of Ceramics and Decorative Arts, Basilica de la Virgen de los Desamparados and Turia Gardens. The nearest airport is Valencia Airport, 9 km from the accommodation."
140,Valencia,2024-02-23,2024-03-03,Hotelito Boutique Valencia Estación,"€ 1,190",,7.9,https://www.booking.com/hotel/es/hotelito-boutique-valencia-estacion-1.en-gb.html?label=gen173nr-1FCAEoggI46AdICVgEaEaIAQGYAQm4AQfIAQ_YAQHoAQH4AQKIAgGoAgO4Ar2yua0GwAIB0gIkOTA3YTVlNDAtNjVmOS00MmQyLWFjZGMtZDdiMWYwOTg3MmE42AIF4AIB&aid=304142&ucfs=1&arphpl=1&checkin=2024-02-23&checkout=2024-03-03&dest_id=-406131&dest_type=city&group_adults=2&req_adults=2&no_rooms=1&group_children=0&req_children=0&hpos=15&hapos=140&sr_order=popularity&srpvid=689554a7c1b004a5&srepoch=1705924975&all_sr_blocks=821041008_344924427_0_0_0&highlighted_blocks=821041008_344924427_0_0_0&matching_block_id=821041008_344924427_0_0_0&sr_pri_blocks=821041008_344924427_0_0_0__118980&from=searchresults#hotelTmpl,"Hotelito Boutique Valencia Estación is set in the Extramurs district of Valencia, 1.7 km from Church of Saint Nicolás, 3 km from Turia Gardens and 1.4 km from González Martí National Museum of Ceramics and Decorative Arts. It is situated 1.7 km from Basilica de la Virgen de los Desamparados and offers luggage storage space. Free WiFi is available throughout the property and Norte Train Station is 700 metres away.

At the apartment complex, the units come with a desk, a flat-screen TV, a private bathroom, bed linen and towels. Units include a coffee machine, while some rooms come with a fully equipped kitchen with an oven, a microwave and a stovetop. The units at the apartment complex feature air conditioning and a wardrobe.

Jardines de Monforte is 3.6 km from the apartment, while Bioparc Valencia is 4.6 km away. The nearest airport is Valencia Airport, 8 km from Hotelito Boutique Valencia Estación."
141,Valencia,2024-02-23,2024-03-03,Limin Hostel Capsules,€ 298,,6.2,https://www.booking.com/hotel/es/limin-hostel-capsules.en-gb.html?label=gen173nr-1FCAEoggI46AdICVgEaEaIAQGYAQm4AQfIAQ_YAQHoAQH4AQKIAgGoAgO4Ar2yua0GwAIB0gIkOTA3YTVlNDAtNjVmOS00MmQyLWFjZGMtZDdiMWYwOTg3MmE42AIF4AIB&aid=304142&ucfs=1&arphpl=1&checkin=2024-02-23&checkout=2024-03-03&dest_id=-406131&dest_type=city&group_adults=2&req_adults=2&no_rooms=1&group_children=0&req_children=0&hpos=16&hapos=141&sr_order=popularity&srpvid=689554a7c1b004a5&srepoch=1705924975&all_sr_blocks=966099502_369098787_2_0_0&highlighted_blocks=966099502_369098787_2_0_0&matching_block_id=966099502_369098787_2_0_0&sr_pri_blocks=966099502_369098787_2_0_0__29759&from=searchresults#hotelTmpl,"Situated in Valencia and with Playa de las Arenas reachable within 1.7 km, Limin Hostel Capsules features a shared lounge, non-smoking rooms, free WiFi throughout the property and a terrace. The property is around 2.3 km from Malvarrosa Beach, 1 km from Puerto de Valencia and 3.3 km from L'Oceanografic. Turia Gardens is 3.9 km away and Jardines de Monforte is 4.1 km from the capsule hotel.

Rooms come with a shared bathroom with a shower, free toiletries and a hairdryer. At the capsule hotel every room includes bed linen and towels.

Speaking English, Spanish, Hindi and Urdu, staff are always on hand to help at the reception.

Norte Train Station is 4.7 km from Limin Hostel Capsules, while González Martí National Museum of Ceramics and Decorative Arts is 5.1 km from the property. The nearest airport is Valencia Airport, 13 km from the accommodation."
142,Valencia,2024-02-23,2024-03-03,Mon Suites San Nicolas,"€ 1,431",Entire apartment • 1 bedroom • 1 bathroom • 1 kitchen • 30m²,8.8,https://www.booking.com/hotel/es/be-flats-san-nicolas.en-gb.html?label=gen173nr-1FCAEoggI46AdICVgEaEaIAQGYAQm4AQfIAQ_YAQHoAQH4AQKIAgGoAgO4Ar2yua0GwAIB0gIkOTA3YTVlNDAtNjVmOS00MmQyLWFjZGMtZDdiMWYwOTg3MmE42AIF4AIB&aid=304142&ucfs=1&arphpl=1&checkin=2024-02-23&checkout=2024-03-03&dest_id=-406131&dest_type=city&group_adults=2&req_adults=2&no_rooms=1&group_children=0&req_children=0&hpos=17&hapos=142&sr_order=popularity&srpvid=689554a7c1b004a5&srepoch=1705924975&all_sr_blocks=411722501_125511082_0_0_0&highlighted_blocks=411722501_125511082_0_0_0&matching_block_id=411722501_125511082_0_0_0&sr_pri_blocks=411722501_125511082_0_0_0__143078&from_sustainable_property_sr=1&from=searchresults#hotelTmpl,"Located in the centre of Valencia, 1.1 km from Norte Train Station and 200 metres from Church of Saint Nicolás, Mon Suites San Nicolas offers free WiFi and air conditioning. This sustainable apartment is located 1.4 km from Turia Gardens and 500 metres from González Martí National Museum of Ceramics and Decorative Arts. The apartment features family rooms.

Featuring a fully equipped kitchen with a dishwasher and an oven, each unit also comes with a safety deposit box, a satellite flat-screen TV, ironing facilities, desk and a seating area. A microwave, a toaster and fridge are also provided, as well as a coffee machine and a kettle. The units include a private bathroom, a hair dryer and bed linen.

Sightseeing tours are available in the surroundings.

Popular points of interest near the apartment include Basilica de la Virgen de los Desamparados, Jardines de Monforte and Valencia Silk Exchange. The nearest airport is Valencia Airport, 8 km from Mon Suites San Nicolas."
143,Valencia,2024-02-23,2024-03-03,NEW Charming Spanish Beach Flat,"€ 1,206",Entire apartment • 1 bedroom • 1 bathroom • 1 kitchen • 50m²,9.5,https://www.booking.com/hotel/es/new-charming-spanish-beach-flat.en-gb.html?label=gen173nr-1FCAEoggI46AdICVgEaEaIAQGYAQm4AQfIAQ_YAQHoAQH4AQKIAgGoAgO4Ar2yua0GwAIB0gIkOTA3YTVlNDAtNjVmOS00MmQyLWFjZGMtZDdiMWYwOTg3MmE42AIF4AIB&aid=304142&ucfs=1&arphpl=1&checkin=2024-02-23&checkout=2024-03-03&dest_id=-406131&dest_type=city&group_adults=2&req_adults=2&no_rooms=1&group_children=0&req_children=0&hpos=18&hapos=143&sr_order=popularity&srpvid=689554a7c1b004a5&srepoch=1705924975&all_sr_blocks=846032901_383195669_2_0_0&highlighted_blocks=846032901_383195669_2_0_0&matching_block_id=846032901_383195669_2_0_0&sr_pri_blocks=846032901_383195669_2_0_0__120600&from=searchresults#hotelTmpl,"Located in Valencia, 600 metres from Playa de las Arenas and 1.1 km from Malvarrosa Beach, NEW Charming Spanish Beach Flat provides air-conditioned accommodation with a terrace and free WiFi. The property is around 1.3 km from Puerto de Valencia, 4.3 km from Turia Gardens and 4.5 km from L'Oceanografic. The property is non-smoking and is situated 2 km from Patacona Beach.

The apartment features 1 bedroom, a flat-screen TV, a fully equipped kitchen with a dishwasher and an oven, a washing machine, and 1 bathroom with a walk-in shower. Towels and bed linen are featured in the apartment. The property has an outdoor dining area.

Jardines de Monforte is 4.6 km from the apartment, while González Martí National Museum of Ceramics and Decorative Arts is 5 km away. The nearest airport is Valencia Airport, 13 km from NEW Charming Spanish Beach Flat."
144,Valencia,2024-02-23,2024-03-03,Lovely apartment near beach & Science City,"€ 1,349",Entire apartment • 2 bedrooms • 1 living room • 3 bathrooms • 1 kitchen • 85m²,,https://www.booking.com/hotel/es/ilearn-home.en-gb.html?label=gen173nr-1FCAEoggI46AdICVgEaEaIAQGYAQm4AQfIAQ_YAQHoAQH4AQKIAgGoAgO4Ar2yua0GwAIB0gIkOTA3YTVlNDAtNjVmOS00MmQyLWFjZGMtZDdiMWYwOTg3MmE42AIF4AIB&aid=304142&ucfs=1&arphpl=1&checkin=2024-02-23&checkout=2024-03-03&dest_id=-406131&dest_type=city&group_adults=2&req_adults=2&no_rooms=1&group_children=0&req_children=0&hpos=19&hapos=144&sr_order=popularity&srpvid=689554a7c1b004a5&srepoch=1705924975&all_sr_blocks=1067261201_379123316_4_0_0&highlighted_blocks=1067261201_379123316_4_0_0&matching_block_id=1067261201_379123316_4_0_0&sr_pri_blocks=1067261201_379123316_4_0_0__134871&from_sustainable_property_sr=1&from=searchresults#hotelTmpl,"Situated in Valencia, 2.2 km from Playa de las Arenas and 2.8 km from Malvarrosa Beach, Lovely apartment near beach & Science City features air-conditioned accommodation with a patio and free WiFi. This recently renovated apartment is located 1.6 km from Puerto de Valencia and 3 km from Turia Gardens. The apartment features facilities for disabled guests.

The spacious apartment with a terrace and garden views has 2 bedrooms, a living room, a flat-screen TV, an equipped kitchen with a dishwasher and an oven, and 3 bathrooms with a walk-in shower. A private entrance leads guests into the apartment, where they can enjoy some fruits and chocolates or cookies. This apartment is non-smoking and soundproof.

There is a snack bar on-site.

For guests with children, the apartment provides a baby safety gate and a children's playground. If you would like to discover the area, snorkelling, cycling and hiking are possible in the surroundings and Lovely apartment near beach & Science City can arrange a bicycle rental service.

Jardines de Monforte is 3.3 km from the accommodation, while L'Oceanografic is 3.4 km from the property. The nearest airport is Valencia Airport, 13 km from Lovely apartment near beach & Science City."
145,Valencia,2024-02-23,2024-03-03,Marittimo Apartments,€ 732,Entire apartment • 1 bedroom • 1 living room • 1 bathroom • 1 kitchen • 35m²,8.9,https://www.booking.com/hotel/es/marittimo-apartments.en-gb.html?label=gen173nr-1FCAEoggI46AdICVgEaEaIAQGYAQm4AQfIAQ_YAQHoAQH4AQKIAgGoAgO4Ar2yua0GwAIB0gIkOTA3YTVlNDAtNjVmOS00MmQyLWFjZGMtZDdiMWYwOTg3MmE42AIF4AIB&aid=304142&ucfs=1&arphpl=1&checkin=2024-02-23&checkout=2024-03-03&dest_id=-406131&dest_type=city&group_adults=2&req_adults=2&no_rooms=1&group_children=0&req_children=0&hpos=20&hapos=145&sr_order=popularity&srpvid=689554a7c1b004a5&srepoch=1705924975&all_sr_blocks=754473501_332146049_0_0_0&highlighted_blocks=754473501_332146049_0_0_0&matching_block_id=754473501_332146049_0_0_0&sr_pri_blocks=754473501_332146049_0_0_0__73183&from_sustainable_property_sr=1&from=searchresults#hotelTmpl,"Surrounded by views of the quiet street, Marittimo Apartments is a sustainable apartment in Valencia, offering guests an environmentally friendly accommodation close to Playa de las Arenas. The air-conditioned accommodation is 1.3 km from Malvarrosa Beach. The apartment features family rooms.

The accommodation comes with a flat-screen TV and a private bathroom with shower and a hair dryer, while the kitchen has an oven, a microwave and a fridge. Free WiFi is accessible to all guests, while some rooms also feature a terrace. The units are equipped with heating facilities.

Patacona Beach is 2.2 km from the apartment, while Puerto de Valencia is 1.1 km from the property. The nearest airport is Valencia Airport, 14 km from Marittimo Apartments."
146,Valencia,2024-02-23,2024-03-03,Valencia Centro. Wifi/AACC Jacuzzi,"€ 1,293",Entire apartment • 2 bedrooms • 2 bathrooms • 80m²,7.6,https://www.booking.com/hotel/es/valencia-centro-wifi-47-aacc-jacuzzi.en-gb.html?label=gen173nr-1FCAEoggI46AdICVgEaEaIAQGYAQm4AQfIAQ_YAQHoAQH4AQKIAgGoAgO4Ar2yua0GwAIB0gIkOTA3YTVlNDAtNjVmOS00MmQyLWFjZGMtZDdiMWYwOTg3MmE42AIF4AIB&aid=304142&ucfs=1&arphpl=1&checkin=2024-02-23&checkout=2024-03-03&dest_id=-406131&dest_type=city&group_adults=2&req_adults=2&no_rooms=1&group_children=0&req_children=0&hpos=21&hapos=146&sr_order=popularity&srpvid=689554a7c1b004a5&srepoch=1705924975&all_sr_blocks=622039701_275886899_4_0_0&highlighted_blocks=622039701_275886899_4_0_0&matching_block_id=622039701_275886899_4_0_0&sr_pri_blocks=622039701_275886899_4_0_0__129321&from=searchresults#hotelTmpl,"Located in the centre of Valencia, 1.1 km from Norte Train Station and 200 metres from Church of Saint Nicolás, Valencia Centro. Wifi/AACC Jacuzzi offers free WiFi and air conditioning. Guests staying at this apartment have access to a balcony. The property is non-smoking and is situated 1.4 km from Turia Gardens.

The spacious apartment features 2 bedrooms, a flat-screen TV, an equipped kitchen, a washing machine and 2 bathrooms with a shower.

Popular points of interest near the apartment include González Martí National Museum of Ceramics and Decorative Arts, Basilica de la Virgen de los Desamparados and Jardines de Monforte. The nearest airport is Valencia Airport, 8 km from Valencia Centro. Wifi/AACC Jacuzzi."
147,Valencia,2024-02-23,2024-03-03,Melia Valencia,"€ 2,766",Private suite • 1 bedroom • 1 living room • 2 bathrooms • 50m²,8.5,https://www.booking.com/hotel/es/melia-valencia.en-gb.html?label=gen173nr-1FCAEoggI46AdICVgEaEaIAQGYAQm4AQfIAQ_YAQHoAQH4AQKIAgGoAgO4Ar2yua0GwAIB0gIkOTA3YTVlNDAtNjVmOS00MmQyLWFjZGMtZDdiMWYwOTg3MmE42AIF4AIB&aid=304142&ucfs=1&arphpl=1&checkin=2024-02-23&checkout=2024-03-03&dest_id=-406131&dest_type=city&group_adults=2&req_adults=2&no_rooms=1&group_children=0&req_children=0&hpos=22&hapos=147&sr_order=popularity&srpvid=689554a7c1b004a5&srepoch=1705924975&all_sr_blocks=29049307_91989386_2_33_0&highlighted_blocks=29049307_91989386_2_33_0&matching_block_id=29049307_91989386_2_33_0&sr_pri_blocks=29049307_91989386_2_33_0__276600&from_sustainable_property_sr=1&from=searchresults#hotelTmpl,"This modern Melia hotel is next to Valencia’s Palacio de Congresos Congress Centre and 5 km from the AVE Train Station. Beniferri Metro Station is just 400 metres away.

The spacious rooms feature contemporary design and offer spectacular views and a 49' flat-screen satellite TV. All are air conditioned and have free WiFi and modern bathrooms.

The hotel has a play area for children. Meeting rooms are available.  Some areas of the hotel are dedicated to The Level rooms and exclusive services, such as a private check-in and check-out area, exclusive buffet breakfast, daily snacks and drinks in a private area, as well as concierge service and organization of activities in the hotel. city.

Manises International Airport is just 15 minutes’ drive from the Melia Valencia.

The hotel's Socarrat restaurant specializes in Valencian paellas, as well as Mediterranean and international cuisine. The Oval Bar has a small snack and drink menu for every hour of the day."
148,Valencia,2024-02-23,2024-03-03,Exclusive Beach Apartment,"€ 1,475",Entire apartment • 3 bedrooms • 1 living room • 2 bathrooms • 1 kitchen • 85m²,8.0,https://www.booking.com/hotel/es/exclusive-beach-apartment-valencia.en-gb.html?label=gen173nr-1FCAEoggI46AdICVgEaEaIAQGYAQm4AQfIAQ_YAQHoAQH4AQKIAgGoAgO4Ar2yua0GwAIB0gIkOTA3YTVlNDAtNjVmOS00MmQyLWFjZGMtZDdiMWYwOTg3MmE42AIF4AIB&aid=304142&ucfs=1&arphpl=1&checkin=2024-02-23&checkout=2024-03-03&dest_id=-406131&dest_type=city&group_adults=2&req_adults=2&no_rooms=1&group_children=0&req_children=0&hpos=23&hapos=148&sr_order=popularity&srpvid=689554a7c1b004a5&srepoch=1705924975&all_sr_blocks=464169101_204505158_2_0_0&highlighted_blocks=464169101_204505158_2_0_0&matching_block_id=464169101_204505158_2_0_0&sr_pri_blocks=464169101_204505158_2_0_0__147496&from=searchresults#hotelTmpl,"Set in Valencia, 600 metres from Malvarrosa Beach and less than 1 km from Patacona Beach, Exclusive Beach Apartment offers a terrace and air conditioning. The property has quiet street views and is 3.4 km from Puerto de Valencia and 5.2 km from Jardines de Monforte. The property is non-smoking and is situated 1.3 km from Playa de las Arenas.

The spacious apartment with a balcony and city views features 3 bedrooms, a living room, a flat-screen TV, an equipped kitchen with a dishwasher and an oven, and 2 bathrooms with a walk-in shower. Towels and bed linen are featured in the apartment. Additional in-room amenities include fruits.

A bicycle rental service is available at the apartment.

Turia Gardens is 5.6 km from Exclusive Beach Apartment, while González Martí National Museum of Ceramics and Decorative Arts is 6 km away. The nearest airport is Valencia Airport, 14 km from the accommodation."
